Online_Grocery_Site,Product_Catagory,Product_Name,Quantity,Original_Price,Discounted_Price
naturesbasket.co.in,World Foods,Shitake Mushroom 250 g 1 kg,,824.75,824.75
naturesbasket.co.in,World Foods,Borges Extra Virgin Olive Oil  Pe..,2L,2700.0,2700.0
naturesbasket.co.in,World Foods,Colavita Extra Virg Olive Oil Pet 5..,,1495.0,1495.0
naturesbasket.co.in,World Foods,Salsalito Original Tortilla Wrap 34..,,190.0,190.0
naturesbasket.co.in,World Foods,Borges Extra Virgin Olive Oil Pet 5..,,1050.0,1050.0
naturesbasket.co.in,World Foods,Borges Extra Virgin Olive Oil Jar 2..,,400.0,364.0
naturesbasket.co.in,World Foods,Wingreens Farms Original Classic Hu..,,200.0,134.0
naturesbasket.co.in,World Foods,Brown Shimeji Mushroom 150 g 300 g,,494.85,494.85
naturesbasket.co.in,World Foods,Wingreens Original Olive Hummus 150..,,200.0,134.0
naturesbasket.co.in,World Foods,Barilla Basilico Pasta Sauce,400G,499.0,499.0
naturesbasket.co.in,World Foods,Mushroom Shi-Meji White Kg  125 g 1 kg,125G,412.38,412.38
naturesbasket.co.in,World Foods,Enoki Mushroom 1 kg,,3399.0,3399.0
naturesbasket.co.in,World Foods,Black And Green Avocado Oil  B..,500Ml,1599.0,1599.0
naturesbasket.co.in,World Foods,Wingreens Farms Basil Pesto,150G,250.0,250.0
naturesbasket.co.in,World Foods,Barilla Arrabiata Pasta Sauce,400G,499.0,499.0
naturesbasket.co.in,World Foods,Bertolli Extra Light Olive Oil Jar ..,,4299.0,4299.0
naturesbasket.co.in,World Foods,Barilla Penne Rigate Pasta  Box,500G,329.0,329.0
naturesbasket.co.in,World Foods,Carbamide Forte Coconut Oil  J..,500Ml,679.0,679.0
naturesbasket.co.in,World Foods,Dabur Hommade Coconut Milk  Po..,200Ml,75.0,75.0
naturesbasket.co.in,World Foods,Sorrentina Basil Seed Pesto  Ja..,200G,375.0,349.0
naturesbasket.co.in,World Foods,Rafael Salgado Extra Light Olive Oi..,,3339.0,2470.86
naturesbasket.co.in,World Foods,Borges Pure Olive Oil  Bottle,1L,1350.0,1170.0
naturesbasket.co.in,World Foods,Sorrentina Italian Garlic Hummus 20..,,299.0,259.0
naturesbasket.co.in,World Foods,Wingreens Farms Dill Tzatziki,150G,200.0,200.0
naturesbasket.co.in,World Foods,Wingreens Farms Garlic Dip,150G,200.0,134.0
naturesbasket.co.in,World Foods,Bombucha Sauerkraut Kimchi,450G,450.0,430.0
naturesbasket.co.in,World Foods,Nongshim Shn Rmyn Noodle Soup 5In1 .. click here or scroll to view more,,599.0,599.0
naturesbasket.co.in,"Breakfast, Jams, Honey, Spreads",Conscious Food Wild Forest Honey 20..,,240.0,228.0
naturesbasket.co.in,"Breakfast, Jams, Honey, Spreads",Nutella Hazelnut Spread  Jar,180G,239.0,239.0
naturesbasket.co.in,"Breakfast, Jams, Honey, Spreads",Conscious Food Wild Forest Honey 50..,,480.0,456.0
naturesbasket.co.in,"Breakfast, Jams, Honey, Spreads",Id 100% Authentic Fresh Batter Idly..,,90.0,90.0
naturesbasket.co.in,"Breakfast, Jams, Honey, Spreads",Wingreens Farms Original Classic Hu..,,200.0,134.0
naturesbasket.co.in,"Breakfast, Jams, Honey, Spreads",Wingreens Original Olive Hummus 150..,,200.0,134.0
naturesbasket.co.in,"Breakfast, Jams, Honey, Spreads",Bobs Red Mill Gluten Free Roled Oat..,,1330.0,1330.0
naturesbasket.co.in,"Breakfast, Jams, Honey, Spreads",Nutella Hazelnut Spread  Jar,350G,399.0,399.0
naturesbasket.co.in,"Breakfast, Jams, Honey, Spreads",Wingreens Farms Basil Pesto,150G,250.0,250.0
naturesbasket.co.in,"Breakfast, Jams, Honey, Spreads",The Whole Truth Double Cocoa Protei..,,100.0,100.0
naturesbasket.co.in,"Breakfast, Jams, Honey, Spreads",The Whole Truth Nuts Fruits & Seeds..,,325.0,325.0
naturesbasket.co.in,"Breakfast, Jams, Honey, Spreads",The Whole Truth Choco Variety Prote..,,600.0,600.0
naturesbasket.co.in,"Breakfast, Jams, Honey, Spreads",Conscious Food Himalayan Multi Flor..,,680.0,612.0
naturesbasket.co.in,"Breakfast, Jams, Honey, Spreads",Sorrentina Basil Seed Pesto  Ja..,200G,375.0,349.0
naturesbasket.co.in,"Breakfast, Jams, Honey, Spreads",Healthy Alternatives Rolled Oats500..,,215.0,215.0
naturesbasket.co.in,"Breakfast, Jams, Honey, Spreads",Sorrentina Italian Garlic Hummus 20..,,299.0,259.0
naturesbasket.co.in,"Breakfast, Jams, Honey, Spreads",Wingreens Farms Dill Tzatziki,150G,200.0,200.0
naturesbasket.co.in,"Breakfast, Jams, Honey, Spreads",Wingreens Farms Garlic Dip,150G,200.0,134.0
naturesbasket.co.in,"Breakfast, Jams, Honey, Spreads",The Whole Truth Cranberry Protein B..,,100.0,100.0
naturesbasket.co.in,"Breakfast, Jams, Honey, Spreads",The Whole Truth Choco Fruit Cruch ..,,325.0,325.0
naturesbasket.co.in,"Breakfast, Jams, Honey, Spreads",Ferrero Nutella,750G,769.0,769.0
naturesbasket.co.in,"Breakfast, Jams, Honey, Spreads",Wingreens Farms Cheesy Jalapeno Sau..,,250.0,250.0
naturesbasket.co.in,"Breakfast, Jams, Honey, Spreads",Wingreens Farms Chipotle Dip Spread..,,200.0,134.0
naturesbasket.co.in,"Breakfast, Jams, Honey, Spreads",Saucery Aglio Olio Sauce,200G,290.0,290.0
naturesbasket.co.in,"Breakfast, Jams, Honey, Spreads",Heinz Organic Tomato Ketchup Top Do..,,1195.0,1195.0
naturesbasket.co.in,"Breakfast, Jams, Honey, Spreads",Wingreens Farms Peri Peri Hummus Di..,,200.0,200.0
naturesbasket.co.in,"Breakfast, Jams, Honey, Spreads",Ritebite Max Prot Ult Choberry,100G,175.0,175.0
naturesbasket.co.in,"Breakfast, Jams, Honey, Spreads",The Whole Truth Peanut Cocao Protei..,,100.0,100.0
naturesbasket.co.in,"Breakfast, Jams, Honey, Spreads",Bobs Red Mill Extra Thick Rolled Oa..,,830.0,830.0
naturesbasket.co.in,"Breakfast, Jams, Honey, Spreads",Ritebite Max Protein Daily (10G Pro.. click here or scroll to view more,,175.0,175.0
naturesbasket.co.in,Grocery,Parsi Dairy Cows Ghee L,,1245.0,1245.0
naturesbasket.co.in,Grocery,Parsi Dairy Cows Ghee L,,1245.0,1245.0
naturesbasket.co.in,Grocery,Natures American Almonds,1Kg,1299.0,1299.0
naturesbasket.co.in,Grocery,Conscious Food Gir Cow Ghee  J..,500Ml,2250.0,2137.5
naturesbasket.co.in,Grocery,Parsi Dairy Cows Ghee 500 Ml,,650.0,650.0
naturesbasket.co.in,Grocery,Conscious Food Desi A2 Cowghee  B..,1L,2190.0,2080.5
naturesbasket.co.in,Grocery,Healthy Alternatives Organic Walnut..,,1399.0,1399.0
naturesbasket.co.in,Grocery,Dry Fruits Gift  Box,400G,375.0,375.0
naturesbasket.co.in,Grocery,Ha Bn Chilean Walnuts 250 g 500 g 1 kg,,625.0,625.0
naturesbasket.co.in,Grocery,Colavita Extra Virgin Olive Oil  ..,1L,2495.0,2495.0
naturesbasket.co.in,Grocery,Ha Bn Mamra Almonds 250 g 500 g 1 kg,,1200.0,1200.0
naturesbasket.co.in,Grocery,Conscious Food Wild Forest Honey 50..,,480.0,456.0
naturesbasket.co.in,Grocery,Medjoul Super Jumbo Dates 1 kg 250 g 500 g,,3440.0,3440.0
naturesbasket.co.in,Grocery,Borges Olive Oil Glass Bottle L,,1350.0,1170.0
naturesbasket.co.in,Grocery,Healthy Alternatives Walnut Kernel ..,,768.0,768.0
naturesbasket.co.in,Grocery,Natures Figs  Pouch,250G,1119.0,1119.0
naturesbasket.co.in,Grocery,Borges Extra Virgin Olive Oil  Pe..,2L,2700.0,2700.0
naturesbasket.co.in,Grocery,Concious Food Desi Cow Ghee  J..,500Ml,1090.0,1090.0
naturesbasket.co.in,Grocery,Colavita Extra Virg Olive Oil Pet 5..,,1495.0,1495.0
naturesbasket.co.in,Grocery,Ha Bn Anjeer Aaa 250 g 500 g 1 kg,,900.0,900.0
naturesbasket.co.in,Grocery,Helthy Alternative Dates Medjoul 30..,,649.0,649.0
naturesbasket.co.in,Grocery,Borges Extra Virgin Olive Oil Pet 5..,,1050.0,1050.0
naturesbasket.co.in,Grocery,Borges Extra Virgin Olive Oil Jar 2..,,400.0,364.0
naturesbasket.co.in,Grocery,Healthy Alternatives Saudi Dates 50..,,699.0,699.0
naturesbasket.co.in,Grocery,Natures Cashew Whole 240,500G,999.0,999.0
naturesbasket.co.in,Grocery,Ha Bn Khajoor Medjul 250 g 500 g 1 kg,,624.75,624.75
naturesbasket.co.in,Grocery,Black And Green Avocado Oil  B..,500Ml,1599.0,1599.0
naturesbasket.co.in,Grocery,Healthy Alternatives Almond Flour ..,,1420.0,1420.0
naturesbasket.co.in,Grocery,Ajwa Dates 1 kg 250 g 500 g,,2560.0,2560.0
naturesbasket.co.in,Grocery,Sanjeevani Traditional Ghee  .. click here or scroll to view more,600Ml,1035.0,1035.0
naturesbasket.co.in,Gourmet Platters,Nb Classy Cheese Platter,,1500.0,1500.0
naturesbasket.co.in,Gourmet Platters,Cheese And Me,,399.0,399.0
naturesbasket.co.in,Gourmet Platters,Nb Premium Cheese Platter,,4000.0,4000.0
naturesbasket.co.in,Gourmet Platters,Meat Platter Turkey - 699,,699.0,699.0
naturesbasket.co.in,Gourmet Platters,Meat Platter Chicken & Turkey - 999,,999.0,999.0
naturesbasket.co.in,Gourmet Platters,Meat Platter Chicken Turkey Pork - ..,,899.0,899.0
naturesbasket.co.in,Gourmet Platters,Get Fetagoudapepper Jackbrie In One..,,799.0,799.0
naturesbasket.co.in,Gourmet Platters,Meat Platter Chicken & Pork - 799,,799.0,799.0
naturesbasket.co.in,Gourmet Platters,Meat Platter Chicken - 399,,399.0,399.0
naturesbasket.co.in,Gourmet Platters,Mini Party Platter,,699.0,699.0
naturesbasket.co.in,Gourmet Platters,Meat Platter Pork - 699,,699.0,699.0
naturesbasket.co.in,Gourmet Platters,Meat Platter Chicken & Turkey Pork ..,,1199.0,1199.0
naturesbasket.co.in,Beverages,Perrier Carbonated Water  Bott..,330Ml,165.0,165.0
naturesbasket.co.in,Beverages,Raw Pressery Orange Juice1l Tetra P..,,350.0,350.0
naturesbasket.co.in,Beverages,Davidoff Rich Aroma Instant Coffee ..,,650.0,650.0
naturesbasket.co.in,Beverages,Himalaya Natural Mineral Water  B..,1L,70.0,70.0
naturesbasket.co.in,Beverages,Davidoff Espresso 57 Intense Instan..,,650.0,650.0
naturesbasket.co.in,Beverages,Raw Pressery Orange Juice  Bot..,250Ml,120.0,120.0
naturesbasket.co.in,Beverages,PRIME TROPICALPUNCH HYDRATION DRINK..,,1050.0,1050.0
naturesbasket.co.in,Beverages,Tea Culture Skin Glow 1 kg 100 g 250 g 500 g,,19900.0,19900.0
naturesbasket.co.in,Beverages,Perrier Carbonated Water  Bott..,750Ml,275.0,275.0
naturesbasket.co.in,Beverages,PRIME BLUE RASPBERRY HYDRATION DRIN..,,1050.0,1050.0
naturesbasket.co.in,Beverages,Tea Culture Throat Rescue Loose Tea 1 kg 100 g 250 g 500 g,,15900.0,15900.0
naturesbasket.co.in,Beverages,PRIME ICE POP SUCETTE GLACEE HYDRAT..,,1050.0,1050.0
naturesbasket.co.in,Beverages,Davidoff Fine Aroma Instant Coffee ..,,650.0,650.0
naturesbasket.co.in,Beverages,Raw Pressery Coconut Water 200 Ml,,60.0,60.0
naturesbasket.co.in,Beverages,Evian Natural Mineral Water,500Ml,150.0,150.0
naturesbasket.co.in,Beverages,Evian Natural Mineral Water,500Ml,150.0,150.0
naturesbasket.co.in,Beverages,Raw Pressery Pomegranate Juice1l Te..,,450.0,450.0
naturesbasket.co.in,Beverages,Only Earth Oats Milk Unsweetened ..,1L,295.0,295.0
naturesbasket.co.in,Beverages,Tea Culture Masala Chai Ctc Loose T.. 1 kg 100 g 250 g 500 g,,3500.0,3500.0
naturesbasket.co.in,Beverages,PRIME LEMON LIME HYDRATION DRINK 50,,1050.0,1050.0
naturesbasket.co.in,Beverages,Raw Pressery Mango Juice  Bottle,1L,250.0,250.0
naturesbasket.co.in,Beverages,Tea Culture Masala Chai Loose Tea 1 kg 100 g 250 g 500 g,,13900.0,13900.0
naturesbasket.co.in,Beverages,Raw Pressery Coconut Water  Bo..,200Ml,360.0,360.0
naturesbasket.co.in,Beverages,Raw Pressery Cold Extracted Great F..,,500.0,500.0
naturesbasket.co.in,Beverages,Tea Culture Detox Loose Tea 1 kg 100 g 250 g 500 g,,15100.0,15100.0
naturesbasket.co.in,Beverages,Tea Culture Jasmine Pearls Loose Te.. 1 kg 100 g 250 g 500 g,,29300.0,29300.0
naturesbasket.co.in,Beverages,Cohoma Original Roasted Coffee ..,250G,685.0,685.0
naturesbasket.co.in,Beverages,Tea Culture Weight Loss 1 kg 100 g 250 g 500 g,,29500.0,29500.0
naturesbasket.co.in,Beverages,Raw Pressery Sugarcane Juice  Tet..,1L,250.0,250.0
naturesbasket.co.in,Beverages,Tea Culture Stressbuster Loose Tea 1 kg 100 g 250 g 500 g click here or scroll to view more,,17000.0,17000.0
naturesbasket.co.in,Snacking,Gadre Edamame  Pouch,500G,500.0,500.0
naturesbasket.co.in,Snacking,Cheetos Flamingo Hot Chips  Pou..,227G,750.0,750.0
naturesbasket.co.in,Snacking,Sapphire Creamy Crackers,350G,200.0,200.0
naturesbasket.co.in,Snacking,Tong Garden Party Snacks,180G,150.0,150.0
naturesbasket.co.in,Snacking,Cheetos Corn Puffs Crunchy Chips 22..,,825.0,825.0
naturesbasket.co.in,Snacking,Zorabian Chicken Seekh Kebab,250G,190.0,190.0
naturesbasket.co.in,Snacking,Prasuma Chicken Momos Original 24 P..,,325.0,276.25
naturesbasket.co.in,Snacking,The Bakers Dozen Handmade Coconut O..,,175.0,175.0
naturesbasket.co.in,Snacking,Prasuma Spicy Chicken Momos,24Pcs,325.0,276.25
naturesbasket.co.in,Snacking,Lexclusif Roasted Potato Chips Salt..,,129.0,129.0
naturesbasket.co.in,Snacking,Zorabian Chicken Sausages  Pouc..,250G,170.0,170.0
naturesbasket.co.in,Snacking,Home Delite Ragi Chips,220G,220.0,220.0
naturesbasket.co.in,Snacking,Yummiez Juicy Chicken Nuggets  ..,750G,475.0,450.0
naturesbasket.co.in,Snacking,Yummiez Juicy Chicken Nuggets  ..,750G,475.0,450.0
naturesbasket.co.in,Snacking,Lotus Biscoff Caramelised Biscuit 2..,,299.0,299.0
naturesbasket.co.in,Snacking,Cheetos Cheese Snacks Cheddar Jalap..,,825.0,825.0
naturesbasket.co.in,Snacking,Tong Garden Party Snack,500G,350.0,350.0
naturesbasket.co.in,Snacking,Very Berry Fruits Frozen Raspberry ..,,350.0,350.0
naturesbasket.co.in,Snacking,Yummiez Juicy Chicken Nuggets  ..,500G,350.0,325.0
naturesbasket.co.in,Snacking,Hb Bakers Choice Almond Cake Rusk ..,,225.0,202.5
naturesbasket.co.in,Snacking,Home Delite Roasted Yellow Banana C..,,260.0,260.0
naturesbasket.co.in,Snacking,Tong Garden Salted Peanuts  Pkt,400G,350.0,350.0
naturesbasket.co.in,Snacking,Tong Garden Salted Peanuts  Pkt,400G,350.0,350.0
naturesbasket.co.in,Snacking,Tong Garden Salted Pistachios Snack..,,1150.0,1150.0
naturesbasket.co.in,Snacking,Pringles Original,149G,325.0,325.0
naturesbasket.co.in,Snacking,The Bakers Dozen Dark Chocolate Coo..,,199.0,199.0
naturesbasket.co.in,Snacking,Home Delite Diet Assorted Chips 220..,,270.0,270.0
naturesbasket.co.in,Snacking,Home Delite Ragi Chakli,220G,220.0,220.0
naturesbasket.co.in,Snacking,Hb Bakers Choice Mawa Cake Rusk 200..,,190.0,171.0
naturesbasket.co.in,Snacking,Loacker Quadratini Cream Kakao Wafe.. click here or scroll to view more,,249.0,249.0
naturesbasket.co.in,Health & Wellness,Sprinng Plain Bread Gluten Free 200..,,230.0,230.0
naturesbasket.co.in,Health & Wellness,Raw Pressery Plain Unsweetened Almo..,,325.0,292.5
naturesbasket.co.in,Health & Wellness,Raw Pressery Plain Unsweetened Almo..,,325.0,292.5
naturesbasket.co.in,Health & Wellness,Healthy Alternatives Organic Walnut..,,1399.0,1399.0
naturesbasket.co.in,Health & Wellness,Amul Lactose Free Drink  Tetra..,250Ml,25.0,25.0
naturesbasket.co.in,Health & Wellness,Organic Tomato,500G,55.0,55.0
naturesbasket.co.in,Health & Wellness,Epigamia Almond Drink Unsweetened 1..,,325.0,260.0
naturesbasket.co.in,Health & Wellness,Organic Ginger,250G,189.0,189.0
naturesbasket.co.in,Health & Wellness,So Good Un Sweetened Almond Milk ..,1L,300.0,270.0
naturesbasket.co.in,Health & Wellness,Akshayakalpa Organic Malai Paneer 2..,,150.0,140.0
naturesbasket.co.in,Health & Wellness,Akshayakalpa Organic Malai Paneer 2..,,150.0,140.0
naturesbasket.co.in,Health & Wellness,Minus 30 Ice Cream - Espresso Vegan..,,1000.0,1000.0
naturesbasket.co.in,Health & Wellness,Raw Pressery Cacao Almond Milk  T..,1L,325.0,325.0
naturesbasket.co.in,Health & Wellness,Raw Pressery Cacao Almond Milk  T..,1L,325.0,325.0
naturesbasket.co.in,Health & Wellness,Wellbeing Nutrition Melts Restful S..,,649.0,649.0
naturesbasket.co.in,Health & Wellness,Minus 30 Ice Cream - Dark Choc Vega..,,1000.0,1000.0
naturesbasket.co.in,Health & Wellness,So Good Unsweetened Almond Milk 200..,,75.0,75.0
naturesbasket.co.in,Health & Wellness,Organic Onion,500G,79.0,79.0
naturesbasket.co.in,Health & Wellness,Heinz Organic Tomato Ketchup Top Do..,,1195.0,1195.0
naturesbasket.co.in,Health & Wellness,The Protein Bread Multi Protein Veg..,,105.0,105.0
naturesbasket.co.in,Health & Wellness,The Protein Bread Multi Protein Veg..,,105.0,105.0
naturesbasket.co.in,Health & Wellness,Dr. Schar Gluten Free Crackers,210G,585.0,585.0
naturesbasket.co.in,Health & Wellness,Organic French Beans,250G,69.0,69.0
naturesbasket.co.in,Health & Wellness,Organic Potato,500G,65.0,65.0
naturesbasket.co.in,Health & Wellness,Minus 30 Ice Cream - Coconut Vegan ..,,1000.0,1000.0
naturesbasket.co.in,Health & Wellness,Organic Okra/Lady Finger,250G,65.0,65.0
naturesbasket.co.in,Health & Wellness,Mooz Vegetable Tofu Organic Soya Pa..,,110.0,110.0
naturesbasket.co.in,Health & Wellness,Chicnutrix Glow Tube Bottle,,1980.0,1980.0
naturesbasket.co.in,Health & Wellness,Organic Coriander,250G,119.0,119.0
naturesbasket.co.in,Health & Wellness,Organic Garlic  click here or scroll to view more,250G,149.0,149.0
Nature's Basket,Best Premium Gift Baskets and Hampers Online,Premium Dry Fruit Box,,999.0,999.0
Nature's Basket,Best Premium Gift Baskets and Hampers Online,Sweet Moments Gift Box,,999.0,999.0
Nature's Basket,Best Premium Gift Baskets and Hampers Online,Chocodate,,99.0,99.0
Nature's Basket,Best Premium Gift Baskets and Hampers Online,Divine Delight,,699.0,699.0
Nature's Basket,Best Premium Gift Baskets and Hampers Online,Occasion's Gift Box,,299.0,299.0
Nature's Basket,Best Premium Gift Baskets and Hampers Online,Chocodate Large,,199.0,199.0
Nature's Basket,Best Premium Gift Baskets and Hampers Online,Divine Home Hamper,,1499.0,1499.0
Nature's Basket,Best Premium Gift Baskets and Hampers Online,Indi Savouries -1+,,999.0,999.0
Nature's Basket,Best Premium Gift Baskets and Hampers Online,Imperial Gift Box,,1149.0,1149.0
Nature's Basket,Best Premium Gift Baskets and Hampers Online,Trunky Surprise - Mint Green,,1700.0,1700.0
Nature's Basket,Best Premium Gift Baskets and Hampers Online,Choti Diwali Festive Box,,799.0,799.0
Nature's Basket,Best Premium Gift Baskets and Hampers Online,Incense Ambrosia,,1299.0,1299.0
Nature's Basket,Best Premium Gift Baskets and Hampers Online,Midnight Lotus Gift Box,,799.0,799.0
Nature's Basket,Best Premium Gift Baskets and Hampers Online,Sabse Choti Diwali Festive Box,,549.0,549.0
Nature's Basket,Best Premium Gift Baskets and Hampers Online,Organic Rangoli With Stencil Large,,249.0,249.0
Nature's Basket,Best Premium Gift Baskets and Hampers Online,Guilt Free Indulgence,,1849.0,1849.0
Nature's Basket,Best Premium Gift Baskets and Hampers Online,Food Lovers Box,,3899.0,3899.0
Nature's Basket,Best Premium Gift Baskets and Hampers Online,Organic Rangoli With Stencil Small,,149.0,149.0
Nature's Basket,Best Premium Gift Baskets and Hampers Online,Guilt Free Gift Bag,,1099.0,1099.0
Nature's Basket,Best Premium Gift Baskets and Hampers Online,Dhoop - Set Of 2,,299.0,299.0
Nature's Basket,Best Premium Gift Baskets and Hampers Online,12 Am Stash,,999.0,999.0
Nature's Basket,Best Premium Gift Baskets and Hampers Online,Sweet Delight,,1049.0,1049.0
Nature's Basket,Best Premium Gift Baskets and Hampers Online,Spill The Beans,,2199.0,2199.0
Nature's Basket,Best Premium Gift Baskets and Hampers Online,The Luxury Superfood Hamper,,6599.0,6599.0
Nature's Basket,Best Premium Gift Baskets and Hampers Online,Coffee & Cookie Bag,,949.0,949.0
Nature's Basket,Best Premium Gift Baskets and Hampers Online,Party Buddy,,1099.0,1099.0
Nature's Basket,Best Premium Gift Baskets and Hampers Online,Stash Bag,,799.0,799.0
Nature's Basket,Best Premium Gift Baskets and Hampers Online,Nutty Bag,,1049.0,1049.0
Nature's Basket,Best Premium Gift Baskets and Hampers Online,Bag Of Treats,,1149.0,1149.0
Nature's Basket,Best Premium Gift Baskets and Hampers Online,Be Infused click here or scroll to view more,,2649.0,2649.0
naturesbasket.co.in,Baking Ingredients & Tools,Natures American Almonds,1Kg,1299.0,1299.0
naturesbasket.co.in,Baking Ingredients & Tools,Ha Bn Chilean Walnuts 250 g 500 g 1 kg,,625.0,625.0
naturesbasket.co.in,Baking Ingredients & Tools,Ha Bn Mamra Almonds 250 g 500 g 1 kg,,1200.0,1200.0
naturesbasket.co.in,Baking Ingredients & Tools,Healthy Alternatives Walnut Kernel ..,,768.0,768.0
naturesbasket.co.in,Baking Ingredients & Tools,Arla Whipping Cream,200Ml,475.0,475.0
naturesbasket.co.in,Baking Ingredients & Tools,Arla Whipping Cream,1L,1425.0,1225.0
naturesbasket.co.in,Baking Ingredients & Tools,Sprig Nat Bourbon Vanilla Extrct 10..,,899.0,899.0
naturesbasket.co.in,Baking Ingredients & Tools,Natures Cashew Whole 240,500G,999.0,999.0
naturesbasket.co.in,Baking Ingredients & Tools,Amul Fresh Cream Milk  Tetra P..,250Ml,68.0,68.0
naturesbasket.co.in,Baking Ingredients & Tools,Puck Whipping Cream  Can,250G,1099.0,1099.0
naturesbasket.co.in,Baking Ingredients & Tools,Natures Pistachio Irani,500G,1219.0,1219.0
naturesbasket.co.in,Baking Ingredients & Tools,Natures Pistachio Irani,500G,1219.0,1219.0
naturesbasket.co.in,Baking Ingredients & Tools,Natures American Almond,500G,649.0,649.0
naturesbasket.co.in,Baking Ingredients & Tools,Healthy Alternatives Almond Mamra 2..,,1189.0,1189.0
naturesbasket.co.in,Baking Ingredients & Tools,Amul Fresh Cream  Tetra Pack,1L,220.0,220.0
naturesbasket.co.in,Baking Ingredients & Tools,Ha Bn American Almonds Premium 250 g 500 g 1 kg,,400.0,400.0
naturesbasket.co.in,Baking Ingredients & Tools,Natures Pista Irani,250G,649.0,649.0
naturesbasket.co.in,Baking Ingredients & Tools,Natures Cashew Whole 210,250G,529.0,529.0
naturesbasket.co.in,Baking Ingredients & Tools,Natures Almond American,250G,649.0,649.0
naturesbasket.co.in,Baking Ingredients & Tools,Natures Almond American,250G,349.0,349.0
naturesbasket.co.in,Baking Ingredients & Tools,Healthy Alternatives Pinenuts,100G,1119.0,1119.0
naturesbasket.co.in,Baking Ingredients & Tools,Ha Bn Cashew240 250 g 500 g 1 kg,,500.0,500.0
naturesbasket.co.in,Baking Ingredients & Tools,Ha Bn Pista Aaa Without Shell 250 g 500 g 1 kg,,1125.0,1125.0
naturesbasket.co.in,Baking Ingredients & Tools,Ha Bn Pistas Kernel 250 g 500 g 1 kg,,950.0,950.0
naturesbasket.co.in,Baking Ingredients & Tools,Lunedemiel Maple Syrup  Bottle,250G,895.0,895.0
naturesbasket.co.in,Baking Ingredients & Tools,Ha Bn American Almonds 250 g 500 g 1 kg,,337.5,337.5
naturesbasket.co.in,Baking Ingredients & Tools,Ha Bn Cashew320 250 g 500 g 1 kg,,412.5,412.5
naturesbasket.co.in,Baking Ingredients & Tools,Nourish Organics Omega Seed Mix 150..,,250.0,250.0
naturesbasket.co.in,Baking Ingredients & Tools,Truefarm Organic Roasted Mixed Nuts..,,750.0,712.5
naturesbasket.co.in,Baking Ingredients & Tools,Natures Kismis - Raisin Black  click here or scroll to view more,200G,229.0,229.0
naturesbasket.co.in,Kitchen Aids & Accessories,TEA CULTURE OUR BEST FOUR,,1500.0,1500.0
naturesbasket.co.in,Kitchen Aids & Accessories,Tea Culture Mesh Ball,,350.0,350.0
naturesbasket.co.in,Kitchen Aids & Accessories,Tea Culture Kamjove Glass Art Tea C..,,1500.0,1500.0
naturesbasket.co.in,Kitchen Aids & Accessories,TEA CULTURE THE MELANGE BOX,,1600.0,1600.0
naturesbasket.co.in,Kitchen Aids & Accessories,TEA CULTURE KEEP SAKE,,1600.0,1600.0
naturesbasket.co.in,Kitchen Aids & Accessories,"Origami Toothpicks,500 Units",,180.0,180.0
naturesbasket.co.in,Kitchen Aids & Accessories,Origami Sosoft Toilet Roll-Pack Of ..,,520.0,520.0
naturesbasket.co.in,Kitchen Aids & Accessories,"Origami So Soft Tissue Box,200 Pull..",,175.0,175.0
naturesbasket.co.in,Kitchen Aids & Accessories,"Origami Paper Lam Plates,",50S,300.0,300.0
naturesbasket.co.in,Kitchen Aids & Accessories,ORIGAMI SOSOFT PARTY NAPKIN  20..,32CM,95.0,95.0
naturesbasket.co.in,Kitchen Aids & Accessories,Tea Culture 50 Gram Metal Tea Tin,,150.0,150.0
naturesbasket.co.in,Kitchen Aids & Accessories,So Soft Wet Wipes 25 Pulls,,95.0,95.0
naturesbasket.co.in,Kitchen Aids & Accessories,Tea Culture 100 Gram Metal Tea Tin,,165.0,165.0
naturesbasket.co.in,Kitchen Aids & Accessories,TCW PLASTIC COFFEE RED POUROVER ..,4CU,780.0,780.0
naturesbasket.co.in,Kitchen Aids & Accessories,TCW POUROVER PAPER FILTER  BROW..,40PC,440.0,440.0
