Online_Grocery_Site,Product_Catagory,Product_Name,Quantity,Original_Price,Discounted_Price
naturesbasket.co.in,Snacking,Zorabian Chicken Seekh Kebab,250G,190.0,190.0
naturesbasket.co.in,Snacking,Prasuma Chicken Momos Original 24 P..,,325.0,276.25
naturesbasket.co.in,Snacking,The Bakers Dozen Handmade Coconut O..,,175.0,175.0
naturesbasket.co.in,Snacking,Prasuma Spicy Chicken Momos,24Pcs,325.0,276.25
naturesbasket.co.in,Snacking,Lexclusif Roasted Potato Chips Salt..,,129.0,129.0
naturesbasket.co.in,Snacking,Zorabian Chicken Sausages  Pouc..,250G,170.0,170.0
naturesbasket.co.in,Snacking,Home Delite Ragi Chips,220G,220.0,220.0
naturesbasket.co.in,Snacking,Yummiez Juicy Chicken Nuggets  ..,750G,475.0,450.0
naturesbasket.co.in,Snacking,Yummiez Juicy Chicken Nuggets  ..,750G,475.0,450.0
naturesbasket.co.in,Snacking,Lotus Biscoff Caramelised Biscuit 2..,,299.0,299.0
naturesbasket.co.in,Snacking,Cheetos Cheese Snacks Cheddar Jalap..,,825.0,825.0
naturesbasket.co.in,Snacking,Tong Garden Party Snack,500G,350.0,350.0
naturesbasket.co.in,Snacking,Very Berry Fruits Frozen Raspberry ..,,350.0,350.0
naturesbasket.co.in,Snacking,Yummiez Juicy Chicken Nuggets  ..,500G,350.0,325.0
naturesbasket.co.in,Snacking,Hb Bakers Choice Almond Cake Rusk ..,,225.0,202.5
naturesbasket.co.in,Snacking,Home Delite Roasted Yellow Banana C..,,260.0,260.0
naturesbasket.co.in,Snacking,Tong Garden Salted Peanuts  Pkt,400G,350.0,350.0
naturesbasket.co.in,Snacking,Tong Garden Salted Peanuts  Pkt,400G,350.0,350.0
naturesbasket.co.in,Snacking,Tong Garden Salted Pistachios Snack..,,1150.0,1150.0
naturesbasket.co.in,Snacking,Pringles Original,149G,325.0,325.0
naturesbasket.co.in,Snacking,The Bakers Dozen Dark Chocolate Coo..,,199.0,199.0
naturesbasket.co.in,Snacking,Home Delite Diet Assorted Chips 220..,,270.0,270.0
naturesbasket.co.in,Snacking,Home Delite Ragi Chakli,220G,220.0,220.0
naturesbasket.co.in,Snacking,Hb Bakers Choice Mawa Cake Rusk 200..,,190.0,171.0
naturesbasket.co.in,Snacking,Loacker Quadratini Cream Kakao Wafe.. click here or scroll to view more,,249.0,249.0
naturesbasket.co.in,Health & Wellness,Sprinng Plain Bread Gluten Free 200..,,230.0,230.0
naturesbasket.co.in,Health & Wellness,Raw Pressery Plain Unsweetened Almo..,,325.0,292.5
naturesbasket.co.in,Health & Wellness,Raw Pressery Plain Unsweetened Almo..,,325.0,292.5
naturesbasket.co.in,Health & Wellness,Healthy Alternatives Organic Walnut..,,1399.0,1399.0
naturesbasket.co.in,Health & Wellness,Amul Lactose Free Drink  Tetra..,250Ml,25.0,25.0
naturesbasket.co.in,Health & Wellness,Organic Tomato,500G,55.0,55.0
naturesbasket.co.in,Health & Wellness,Epigamia Almond Drink Unsweetened 1..,,325.0,260.0
naturesbasket.co.in,Health & Wellness,Organic Ginger,250G,189.0,189.0
naturesbasket.co.in,Health & Wellness,So Good Un Sweetened Almond Milk ..,1L,300.0,270.0
naturesbasket.co.in,Health & Wellness,Akshayakalpa Organic Malai Paneer 2..,,150.0,140.0
naturesbasket.co.in,Health & Wellness,Akshayakalpa Organic Malai Paneer 2..,,150.0,140.0
naturesbasket.co.in,Health & Wellness,Minus 30 Ice Cream - Espresso Vegan..,,1000.0,1000.0
naturesbasket.co.in,Health & Wellness,Raw Pressery Cacao Almond Milk  T..,1L,325.0,325.0
naturesbasket.co.in,Health & Wellness,Raw Pressery Cacao Almond Milk  T..,1L,325.0,325.0
naturesbasket.co.in,Health & Wellness,Wellbeing Nutrition Melts Restful S..,,649.0,649.0
naturesbasket.co.in,Health & Wellness,Minus 30 Ice Cream - Dark Choc Vega..,,1000.0,1000.0
naturesbasket.co.in,Health & Wellness,So Good Unsweetened Almond Milk 200..,,75.0,75.0
naturesbasket.co.in,Health & Wellness,Organic Onion,500G,79.0,79.0
naturesbasket.co.in,Health & Wellness,Heinz Organic Tomato Ketchup Top Do..,,1195.0,1195.0
naturesbasket.co.in,Health & Wellness,The Protein Bread Multi Protein Veg..,,105.0,105.0
naturesbasket.co.in,Health & Wellness,The Protein Bread Multi Protein Veg..,,105.0,105.0
naturesbasket.co.in,Health & Wellness,Dr. Schar Gluten Free Crackers,210G,585.0,585.0
naturesbasket.co.in,Health & Wellness,Organic French Beans,250G,69.0,69.0
naturesbasket.co.in,Health & Wellness,Organic Potato,500G,65.0,65.0
naturesbasket.co.in,Health & Wellness,Minus 30 Ice Cream - Coconut Vegan ..,,1000.0,1000.0
naturesbasket.co.in,Health & Wellness,Organic Okra/Lady Finger,250G,65.0,65.0
naturesbasket.co.in,Health & Wellness,Mooz Vegetable Tofu Organic Soya Pa..,,110.0,110.0
naturesbasket.co.in,Health & Wellness,Chicnutrix Glow Tube Bottle,,1980.0,1980.0
naturesbasket.co.in,Health & Wellness,Organic Coriander,250G,119.0,119.0
naturesbasket.co.in,Health & Wellness,Organic Garlic  click here or scroll to view more,250G,149.0,149.0
Nature's Basket,Best Premium Gift Baskets and Hampers Online,Premium Dry Fruit Box,,999.0,999.0
Nature's Basket,Best Premium Gift Baskets and Hampers Online,Sweet Moments Gift Box,,999.0,999.0
Nature's Basket,Best Premium Gift Baskets and Hampers Online,Chocodate,,99.0,99.0
Nature's Basket,Best Premium Gift Baskets and Hampers Online,Divine Delight,,699.0,699.0
Nature's Basket,Best Premium Gift Baskets and Hampers Online,Occasion's Gift Box,,299.0,299.0
Nature's Basket,Best Premium Gift Baskets and Hampers Online,Chocodate Large,,199.0,199.0
Nature's Basket,Best Premium Gift Baskets and Hampers Online,Divine Home Hamper,,1499.0,1499.0
Nature's Basket,Best Premium Gift Baskets and Hampers Online,Indi Savouries -1+,,999.0,999.0
Nature's Basket,Best Premium Gift Baskets and Hampers Online,Imperial Gift Box,,1149.0,1149.0
Nature's Basket,Best Premium Gift Baskets and Hampers Online,Trunky Surprise - Mint Green,,1700.0,1700.0
Nature's Basket,Best Premium Gift Baskets and Hampers Online,Choti Diwali Festive Box,,799.0,799.0
Nature's Basket,Best Premium Gift Baskets and Hampers Online,Incense Ambrosia,,1299.0,1299.0
Nature's Basket,Best Premium Gift Baskets and Hampers Online,Midnight Lotus Gift Box,,799.0,799.0
Nature's Basket,Best Premium Gift Baskets and Hampers Online,Sabse Choti Diwali Festive Box,,549.0,549.0
Nature's Basket,Best Premium Gift Baskets and Hampers Online,Organic Rangoli With Stencil Large,,249.0,249.0
Nature's Basket,Best Premium Gift Baskets and Hampers Online,Guilt Free Indulgence,,1849.0,1849.0
Nature's Basket,Best Premium Gift Baskets and Hampers Online,Food Lovers Box,,3899.0,3899.0
Nature's Basket,Best Premium Gift Baskets and Hampers Online,Organic Rangoli With Stencil Small,,149.0,149.0
Nature's Basket,Best Premium Gift Baskets and Hampers Online,Guilt Free Gift Bag,,1099.0,1099.0
Nature's Basket,Best Premium Gift Baskets and Hampers Online,Dhoop - Set Of 2,,299.0,299.0
Nature's Basket,Best Premium Gift Baskets and Hampers Online,12 Am Stash,,999.0,999.0
Nature's Basket,Best Premium Gift Baskets and Hampers Online,Sweet Delight,,1049.0,1049.0
Nature's Basket,Best Premium Gift Baskets and Hampers Online,Spill The Beans,,2199.0,2199.0
Nature's Basket,Best Premium Gift Baskets and Hampers Online,The Luxury Superfood Hamper,,6599.0,6599.0
Nature's Basket,Best Premium Gift Baskets and Hampers Online,Coffee & Cookie Bag,,949.0,949.0
Nature's Basket,Best Premium Gift Baskets and Hampers Online,Party Buddy,,1099.0,1099.0
Nature's Basket,Best Premium Gift Baskets and Hampers Online,Stash Bag,,799.0,799.0
Nature's Basket,Best Premium Gift Baskets and Hampers Online,Nutty Bag,,1049.0,1049.0
Nature's Basket,Best Premium Gift Baskets and Hampers Online,Bag Of Treats,,1149.0,1149.0
Nature's Basket,Best Premium Gift Baskets and Hampers Online,Be Infused click here or scroll to view more,,2649.0,2649.0
naturesbasket.co.in,Baking Ingredients & Tools,Natures American Almonds,1Kg,1299.0,1299.0
naturesbasket.co.in,Baking Ingredients & Tools,Ha Bn Chilean Walnuts 250 g 500 g 1 kg,,625.0,625.0
naturesbasket.co.in,Baking Ingredients & Tools,Ha Bn Mamra Almonds 250 g 500 g 1 kg,,1200.0,1200.0
naturesbasket.co.in,Baking Ingredients & Tools,Healthy Alternatives Walnut Kernel ..,,768.0,768.0
naturesbasket.co.in,Baking Ingredients & Tools,Arla Whipping Cream,200Ml,475.0,475.0
naturesbasket.co.in,Baking Ingredients & Tools,Arla Whipping Cream,1L,1425.0,1225.0
naturesbasket.co.in,Baking Ingredients & Tools,Sprig Nat Bourbon Vanilla Extrct 10..,,899.0,899.0
naturesbasket.co.in,Baking Ingredients & Tools,Natures Cashew Whole 240,500G,999.0,999.0
naturesbasket.co.in,Baking Ingredients & Tools,Amul Fresh Cream Milk  Tetra P..,250Ml,68.0,68.0
naturesbasket.co.in,Baking Ingredients & Tools,Puck Whipping Cream  Can,250G,1099.0,1099.0
naturesbasket.co.in,Baking Ingredients & Tools,Natures Pistachio Irani,500G,1219.0,1219.0
naturesbasket.co.in,Baking Ingredients & Tools,Natures Pistachio Irani,500G,1219.0,1219.0
naturesbasket.co.in,Baking Ingredients & Tools,Natures American Almond,500G,649.0,649.0
naturesbasket.co.in,Baking Ingredients & Tools,Healthy Alternatives Almond Mamra 2..,,1189.0,1189.0
naturesbasket.co.in,Baking Ingredients & Tools,Amul Fresh Cream  Tetra Pack,1L,220.0,220.0
naturesbasket.co.in,Baking Ingredients & Tools,Ha Bn American Almonds Premium 250 g 500 g 1 kg,,400.0,400.0
naturesbasket.co.in,Baking Ingredients & Tools,Natures Pista Irani,250G,649.0,649.0
naturesbasket.co.in,Baking Ingredients & Tools,Natures Cashew Whole 210,250G,529.0,529.0
naturesbasket.co.in,Baking Ingredients & Tools,Natures Almond American,250G,649.0,649.0
naturesbasket.co.in,Baking Ingredients & Tools,Natures Almond American,250G,349.0,349.0
naturesbasket.co.in,Baking Ingredients & Tools,Healthy Alternatives Pinenuts,100G,1119.0,1119.0
naturesbasket.co.in,Baking Ingredients & Tools,Ha Bn Cashew240 250 g 500 g 1 kg,,500.0,500.0
naturesbasket.co.in,Baking Ingredients & Tools,Ha Bn Pista Aaa Without Shell 250 g 500 g 1 kg,,1125.0,1125.0
naturesbasket.co.in,Baking Ingredients & Tools,Ha Bn Pistas Kernel 250 g 500 g 1 kg,,950.0,950.0
naturesbasket.co.in,Baking Ingredients & Tools,Lunedemiel Maple Syrup  Bottle,250G,895.0,895.0
naturesbasket.co.in,Baking Ingredients & Tools,Ha Bn American Almonds 250 g 500 g 1 kg,,337.5,337.5
naturesbasket.co.in,Baking Ingredients & Tools,Ha Bn Cashew320 250 g 500 g 1 kg,,412.5,412.5
naturesbasket.co.in,Baking Ingredients & Tools,Nourish Organics Omega Seed Mix 150..,,250.0,250.0
naturesbasket.co.in,Baking Ingredients & Tools,Truefarm Organic Roasted Mixed Nuts..,,750.0,712.5
naturesbasket.co.in,Baking Ingredients & Tools,Natures Kismis - Raisin Black  click here or scroll to view more,200G,229.0,229.0
naturesbasket.co.in,Kitchen Aids & Accessories,TEA CULTURE OUR BEST FOUR,,1500.0,1500.0
naturesbasket.co.in,Kitchen Aids & Accessories,Tea Culture Mesh Ball,,350.0,350.0
naturesbasket.co.in,Kitchen Aids & Accessories,Tea Culture Kamjove Glass Art Tea C..,,1500.0,1500.0
naturesbasket.co.in,Kitchen Aids & Accessories,TEA CULTURE THE MELANGE BOX,,1600.0,1600.0
naturesbasket.co.in,Kitchen Aids & Accessories,TEA CULTURE KEEP SAKE,,1600.0,1600.0
naturesbasket.co.in,Kitchen Aids & Accessories,"Origami Toothpicks,500 Units",,180.0,180.0
naturesbasket.co.in,Kitchen Aids & Accessories,Origami Sosoft Toilet Roll-Pack Of ..,,520.0,520.0
naturesbasket.co.in,Kitchen Aids & Accessories,"Origami So Soft Tissue Box,200 Pull..",,175.0,175.0
naturesbasket.co.in,Kitchen Aids & Accessories,"Origami Paper Lam Plates,",50S,300.0,300.0
naturesbasket.co.in,Kitchen Aids & Accessories,ORIGAMI SOSOFT PARTY NAPKIN  20..,32CM,95.0,95.0
naturesbasket.co.in,Kitchen Aids & Accessories,Tea Culture 50 Gram Metal Tea Tin,,150.0,150.0
naturesbasket.co.in,Kitchen Aids & Accessories,So Soft Wet Wipes 25 Pulls,,95.0,95.0
naturesbasket.co.in,Kitchen Aids & Accessories,Tea Culture 100 Gram Metal Tea Tin,,165.0,165.0
naturesbasket.co.in,Kitchen Aids & Accessories,TCW PLASTIC COFFEE RED POUROVER ..,4CU,780.0,780.0
naturesbasket.co.in,Kitchen Aids & Accessories,TCW POUROVER PAPER FILTER  BROW..,40PC,440.0,440.0
naturesbasket.co.in,Fruits & Vegetables,Avocado Pack  (Approx 550-700G),3Pc,499.0,499.0
naturesbasket.co.in,Fruits & Vegetables,Blueberries Imported Combo Pack (12..,,599.0,599.0
naturesbasket.co.in,Fruits & Vegetables,Blueberries Imported 500 Gm,,1199.0,1199.0
naturesbasket.co.in,Fruits & Vegetables,Apple Royal Gala 500 g 1 kg,,249.5,249.5
naturesbasket.co.in,Fruits & Vegetables,Raspberry Indian 125 Gm Punnet,,449.0,449.0
naturesbasket.co.in,Fruits & Vegetables,Pomegranate Red 500 g 1 kg,,249.5,249.5
naturesbasket.co.in,Fruits & Vegetables,Orange Mandarins Combo (Approx 900 ..,,539.0,539.0
naturesbasket.co.in,Fruits & Vegetables,Pears Beauty Imported 500 g 1 kg,,249.5,249.5
naturesbasket.co.in,Fruits & Vegetables,Broccoli (Approx 250 - ),350G,69.0,59.0
naturesbasket.co.in,Fruits & Vegetables,Imported Avocado,,429.0,429.0
naturesbasket.co.in,Fruits & Vegetables,Elaichi Banana 250 g 500 g 1 kg,,54.75,54.75
naturesbasket.co.in,Fruits & Vegetables,Apple Fuji 500 g 1 kg,,274.5,274.5
naturesbasket.co.in,Fruits & Vegetables,APPLE PINK LADY 4 PC PACK,,279.0,279.0
naturesbasket.co.in,Fruits & Vegetables,Tangerine 500 g 1 kg,,114.5,114.5
naturesbasket.co.in,Fruits & Vegetables,Mushroom Button,200G,55.0,55.0
naturesbasket.co.in,Fruits & Vegetables,Apple Red Delicious Washington 500 g 1 kg,,299.5,299.5
naturesbasket.co.in,Fruits & Vegetables,Imported Blueberry,,349.0,349.0
naturesbasket.co.in,Fruits & Vegetables,Tomato 500 g 1 kg 2 kg,,39.5,39.5
naturesbasket.co.in,Fruits & Vegetables,Kiwi Green  [1 Pack],3Pc,219.0,219.0
naturesbasket.co.in,Fruits & Vegetables,Imported Red Globe Grapes 200 g 500 g 1 kg,,69.8,69.8
naturesbasket.co.in,Fruits & Vegetables,Italian Lemon 150 g 300 g 500 g,,82.35,82.35
naturesbasket.co.in,Fruits & Vegetables,Natures Spinach 200 Gm,,59.0,59.0
naturesbasket.co.in,Fruits & Vegetables,Capsicum Red 1 kg 500 g 250 g,,399.0,399.0
naturesbasket.co.in,Fruits & Vegetables,Apple Pink Lady 1 kg 500 g 250 g,,419.0,419.0
naturesbasket.co.in,Fruits & Vegetables,Apple Pink Lady,,419.0,419.0
naturesbasket.co.in,Fruits & Vegetables,AVOCADO HASS IMPORTED PACK (2PC-450..,,799.0,799.0
naturesbasket.co.in,Fruits & Vegetables,Natures Cherry Tomato Red 200 Gm,,65.0,65.0
naturesbasket.co.in,Fruits & Vegetables,Natures Baby Spinach 200 Gm,,55.0,55.0
naturesbasket.co.in,Fruits & Vegetables,Dragon Fruit Red Flesh  (Approx ..,1Pc,119.0,119.0
naturesbasket.co.in,Fruits & Vegetables,Onion 500 g 1 kg 2 kg click here or scroll to view more,,39.5,39.5
naturesbasket.co.in,"Meats, Seafood & Eggs",Farm Made Free Range Eggs,12Pcs,289.0,289.0
naturesbasket.co.in,"Meats, Seafood & Eggs",Zorabian Chicken Breast Boneless 45..,,275.0,275.0
naturesbasket.co.in,"Meats, Seafood & Eggs",Chicken Breast Bone Less Kg 500 g 1 kg,,295.0,295.0
naturesbasket.co.in,"Meats, Seafood & Eggs",Zorabian Chi Pre Cut Without Skin 9..,,295.0,295.0
naturesbasket.co.in,"Meats, Seafood & Eggs",Zorabian Chicken Leg Boneless,450G,275.0,275.0
naturesbasket.co.in,"Meats, Seafood & Eggs",Mutton Curry Cut Kg 250 g 500 g 1 kg,,257.5,257.5
naturesbasket.co.in,"Meats, Seafood & Eggs",Farm Made Foods Made Free Range Egg..,,149.0,149.0
naturesbasket.co.in,"Meats, Seafood & Eggs",White Prawns Small Kg 250 g 500 g 1 kg,,247.5,137.25
naturesbasket.co.in,"Meats, Seafood & Eggs",Zorabian Chicken Mince,450G,255.0,255.0
naturesbasket.co.in,"Meats, Seafood & Eggs",Zorabian Chi Drumstick Without Skin..,,265.0,265.0
naturesbasket.co.in,"Meats, Seafood & Eggs",Keggs Organic Eggs Pack Of6th,,140.0,140.0
naturesbasket.co.in,"Meats, Seafood & Eggs",Big Sams Salmon Portions,300G,1750.0,1750.0
naturesbasket.co.in,"Meats, Seafood & Eggs",Atlantic Salmon Steaks Kg 250 g 500 g 1 kg,,875.0,875.0
naturesbasket.co.in,"Meats, Seafood & Eggs",Surmai Steaks Kg 250 g 500 g 1 kg,,562.5,562.5
naturesbasket.co.in,"Meats, Seafood & Eggs",Keggs Cage Free Tan Eggs 12 Eggs,,270.0,270.0
naturesbasket.co.in,"Meats, Seafood & Eggs",Chicken Curry Cut Kg 500 g 1 kg,,165.0,165.0
naturesbasket.co.in,"Meats, Seafood & Eggs",Real Good Chicken Chicken Breast B..,,275.0,275.0
naturesbasket.co.in,"Meats, Seafood & Eggs",Gadre Edamame  Pouch,500G,500.0,500.0
naturesbasket.co.in,"Meats, Seafood & Eggs",Real Good Chicken Curry Cut 900 Gm,,295.0,295.0
naturesbasket.co.in,"Meats, Seafood & Eggs",Zorabian Chicken Cubes 500 G,,280.0,280.0
naturesbasket.co.in,"Meats, Seafood & Eggs",Mega Plus Eggs,6Pc,87.0,87.0
naturesbasket.co.in,"Meats, Seafood & Eggs",White Pomfret Medium Kg 1 kg,,1940.0,1940.0
naturesbasket.co.in,"Meats, Seafood & Eggs",Big Sams Salmon Portions,200G,1250.0,1250.0
naturesbasket.co.in,"Meats, Seafood & Eggs",Zorabian Chicken Mixed Boneless 450..,,285.0,285.0
naturesbasket.co.in,"Meats, Seafood & Eggs",Mutton Mince Kg 250 g 500 g 1 kg,,362.5,362.5
naturesbasket.co.in,"Meats, Seafood & Eggs",Prasuma Streaky Bacon  Pouch,150G,395.0,395.0
naturesbasket.co.in,"Meats, Seafood & Eggs",Big Sams Smoked Salmon Slice,100G,950.0,950.0
naturesbasket.co.in,"Meats, Seafood & Eggs",Zorabian Chicken Legs Without Skin ..,,210.0,210.0
naturesbasket.co.in,"Meats, Seafood & Eggs",Keggs Goldens Cage Free Eggs  ..,12Pcs,280.0,280.0
naturesbasket.co.in,"Meats, Seafood & Eggs",Upf Healthy Brown Eggs  Carton click here or scroll to view more,12Pcs,193.0,193.0
naturesbasket.co.in,Bakery & Dairy,Epigamia Natural Yoghurt  Cup,400G,220.0,220.0
naturesbasket.co.in,Bakery & Dairy,Amul Salted Butter  Pkt,100G,58.0,58.0
naturesbasket.co.in,Bakery & Dairy,Amul Salted Butter  Pkt,500G,285.0,285.0
naturesbasket.co.in,Bakery & Dairy,Sprinng Plain Bread Gluten Free 200..,,230.0,230.0
naturesbasket.co.in,Bakery & Dairy,Amul Taaza Toned Uht Milk  Tetra ..,1L,74.0,74.0
naturesbasket.co.in,Bakery & Dairy,Sarda Farm A2 Milk  Tetra Pack,1L,150.0,150.0
naturesbasket.co.in,Bakery & Dairy,Epigamia Natural Yoghurt  Cup,85G,55.0,55.0
naturesbasket.co.in,Bakery & Dairy,Natures Whole Wheat Bread  Pack,400G,85.0,85.0
naturesbasket.co.in,Bakery & Dairy,Raw Pressery Plain Unsweetened Almo..,,325.0,292.5
naturesbasket.co.in,Bakery & Dairy,Raw Pressery Plain Unsweetened Almo..,,325.0,292.5
naturesbasket.co.in,Bakery & Dairy,The Bakers Dozen Sourd Dough Four G..,,235.0,235.0
naturesbasket.co.in,Bakery & Dairy,Natures Multigrain Bread  Pack,400G,95.0,95.0
naturesbasket.co.in,Bakery & Dairy,Epigamia Greek Yogurt Strawberry 90..,,55.0,55.0
naturesbasket.co.in,Bakery & Dairy,Lurpak Salted Butter  Pack,200G,695.0,695.0
naturesbasket.co.in,Bakery & Dairy,Haribol A2 Malai Paneer Made From ..,,160.0,150.0
naturesbasket.co.in,Bakery & Dairy,Epigamia Blueberry Yoghurt  Cup,85G,55.0,55.0
naturesbasket.co.in,Bakery & Dairy,Lurpak Danish Butter Unsalted  ..,200G,695.0,695.0
naturesbasket.co.in,Bakery & Dairy,Natures Guacamole,200G,499.0,499.0
naturesbasket.co.in,Bakery & Dairy,Id Natural Paneer  Pack,200G,130.0,130.0
naturesbasket.co.in,Bakery & Dairy,Id Natural Paneer  Pack,200G,130.0,130.0
naturesbasket.co.in,Bakery & Dairy,Yakult Probiotic Health Drink ..,325Ml,80.0,80.0
naturesbasket.co.in,Bakery & Dairy,Sorrentina Italian Garlic Bread 150..,,129.0,109.0
naturesbasket.co.in,Bakery & Dairy,The Bakers Dozen Country Sourdough ..,,159.0,159.0
naturesbasket.co.in,Bakery & Dairy,Arla Whipping Cream,200Ml,475.0,475.0
naturesbasket.co.in,Bakery & Dairy,Murginns Fresh And Firm Tofu  P..,200G,100.0,100.0
naturesbasket.co.in,Bakery & Dairy,Nutoras Natural Cowmilk Paneer .. 3,200G,110.0,110.0
naturesbasket.co.in,Bakery & Dairy,Sprinng Multiseed Bread  Pouch,200G,240.0,240.0
naturesbasket.co.in,Bakery & Dairy,Epigamia Mango Yoghurt  Cup,85G,55.0,55.0
naturesbasket.co.in,Bakery & Dairy,Arla Whipping Cream,1L,1425.0,1225.0
naturesbasket.co.in,Bakery & Dairy,Amul Lactose Free Drink  Tetra.. click here or scroll to view more,250Ml,25.0,25.0
naturesbasket.co.in,Delicatessen & Cheese,Prasuma Streaky Bacon  Pouch,150G,395.0,395.0
naturesbasket.co.in,Delicatessen & Cheese,Zanetti Gran Spicco Hard Cheese 200..,,995.0,995.0
naturesbasket.co.in,Delicatessen & Cheese,Haribol A2 Malai Paneer Made From ..,,160.0,150.0
naturesbasket.co.in,Delicatessen & Cheese,Rosenborg Danish Brie Cheese  B..,125G,585.0,585.0
naturesbasket.co.in,Delicatessen & Cheese,Dlecta Feta,250G,250.0,229.0
naturesbasket.co.in,Delicatessen & Cheese,Arla Cheese Gouda  Pouch,150G,715.0,715.0
naturesbasket.co.in,Delicatessen & Cheese,Dlecta Cheese Feta  Pack,100G,120.0,111.0
naturesbasket.co.in,Delicatessen & Cheese,Dlecta Parmesan Extra Hard Cheese B..,,300.0,300.0
naturesbasket.co.in,Delicatessen & Cheese,Arla Mozzarella Cheese Block  .. 100 g 200 g 300 g 500 g,2.3Kg,290.0,290.0
naturesbasket.co.in,Delicatessen & Cheese,Id Natural Paneer  Pack,200G,130.0,130.0
naturesbasket.co.in,Delicatessen & Cheese,Id Natural Paneer  Pack,200G,130.0,130.0
naturesbasket.co.in,Delicatessen & Cheese,Amul Cheese Slice  Pkt,200G,145.0,145.0
naturesbasket.co.in,Delicatessen & Cheese,Murginns Fresh And Firm Tofu  P..,200G,100.0,100.0
naturesbasket.co.in,Delicatessen & Cheese,Dlecta Cream Cheese  Tub,150G,200.0,189.0
naturesbasket.co.in,Delicatessen & Cheese,Nutoras Natural Cowmilk Paneer .. 3,200G,110.0,110.0
naturesbasket.co.in,Delicatessen & Cheese,El Pastor Goat Chese Rindles Fresh .. 300 g 200 g 100 g,,1980.0,1980.0
naturesbasket.co.in,Delicatessen & Cheese,Bauwens Tradtional Honey Roasted Ha.. CUTs AVAILABLEThinMediumThickCube 250 g 500 g 1 kg,,1250.0,1250.0
naturesbasket.co.in,Delicatessen & Cheese,Dlecta Cheese Cheddar Slice  Pa..,200G,220.0,199.0
naturesbasket.co.in,Delicatessen & Cheese,Nutoras Cheese Parmesan Block  ..,100G,310.0,310.0
naturesbasket.co.in,Delicatessen & Cheese,Nutoras Cheese Parmesan Block  ..,100G,310.0,310.0
naturesbasket.co.in,Delicatessen & Cheese,Beretta Salami Milano  Pack,100G,725.0,725.0
naturesbasket.co.in,Delicatessen & Cheese,Landana Premium Dutch Gouda  CUTs AVAILABLESlicedCubedGrated 100 g 200 g 300 g 500 g,4.5Kg,278.4,278.4
naturesbasket.co.in,Delicatessen & Cheese,Landana Gouda With Chilli Sambal 4... CUTs AVAILABLESlicedCubedGrated 100 g 200 g 300 g 500 g,,610.0,610.0
naturesbasket.co.in,Delicatessen & Cheese,Wingreens Farms Original Classic Hu..,,200.0,134.0
naturesbasket.co.in,Delicatessen & Cheese,Colliers Cheddar Yellow Cheese Bloc.. CUTs AVAILABLESlicedCubedGrated 100 g 200 g 300 g 500 g,,248.0,248.0
naturesbasket.co.in,Delicatessen & Cheese,Arla Shredded Mozzarella  Pouch,175G,650.0,650.0
naturesbasket.co.in,Delicatessen & Cheese,Prasuma Smoked Bacon Cubes  Pou..,200G,360.0,360.0
naturesbasket.co.in,Delicatessen & Cheese,Wingreens Original Olive Hummus 150..,,200.0,134.0
naturesbasket.co.in,Delicatessen & Cheese,Dlecta Cream Cheese,1Kg,880.0,829.0
naturesbasket.co.in,Delicatessen & Cheese,Dlecta Cheese Cheddar Block  Pa.. click here or scroll to view more,200G,220.0,189.0
naturesbasket.co.in,"Chocolates, Confectionary & Desserts",Ferrero Rocher Gift Pack  (16 P..,200G,549.0,549.0
naturesbasket.co.in,"Chocolates, Confectionary & Desserts",Ferrero Rocher Gift Pack  (16 P..,300G,929.0,929.0
naturesbasket.co.in,"Chocolates, Confectionary & Desserts",Ferrero Rocher 4 Pralines Perfect L..,,159.0,159.0
naturesbasket.co.in,"Chocolates, Confectionary & Desserts",Lindt Napolitains Assorted Chocolat..,,1600.0,1600.0
naturesbasket.co.in,"Chocolates, Confectionary & Desserts",Lindt Lindor Assorted,200G,800.0,800.0
naturesbasket.co.in,"Chocolates, Confectionary & Desserts",Lindt Lindor Balls Milk Chocolate 2..,,800.0,800.0
naturesbasket.co.in,"Chocolates, Confectionary & Desserts",Haagen Dazs Ice Cream Belgian Choco..,,820.0,820.0
naturesbasket.co.in,"Chocolates, Confectionary & Desserts",Lindt Excellence 70% Cocoa Dark 100..,,400.0,400.0
naturesbasket.co.in,"Chocolates, Confectionary & Desserts",Lindt 90% Cocoa Dark Supreme Noir C..,,450.0,450.0
naturesbasket.co.in,"Chocolates, Confectionary & Desserts",Kwality Walls Magnum Almond Ice Cre..,,99.0,99.0
naturesbasket.co.in,"Chocolates, Confectionary & Desserts",The Whole Truth Fruit & Nut Milk Ch..,,99.0,99.0
naturesbasket.co.in,"Chocolates, Confectionary & Desserts",Minus 30 Ice Cream - Espresso Vegan..,,1000.0,1000.0
naturesbasket.co.in,"Chocolates, Confectionary & Desserts",Lindt Excellence Sea Salt Dark Choc..,,400.0,400.0
naturesbasket.co.in,"Chocolates, Confectionary & Desserts",Lindt Lindor Dark Chocolates,200G,1050.0,1050.0
naturesbasket.co.in,"Chocolates, Confectionary & Desserts",Kwality Walls Magnum Truffle Ice Cr..,,99.0,99.0
naturesbasket.co.in,"Chocolates, Confectionary & Desserts",Lindt Excellence Orange Intense Dar..,,400.0,400.0
naturesbasket.co.in,"Chocolates, Confectionary & Desserts",The Whole Truth No Added Sugar 71% ..,,199.0,199.0
naturesbasket.co.in,"Chocolates, Confectionary & Desserts",Minus 30 Ice Cream - Dark Choc Vega..,,1000.0,1000.0
naturesbasket.co.in,"Chocolates, Confectionary & Desserts",The Bakers Dozen Banana Walnut Cake..,,309.0,309.0
naturesbasket.co.in,"Chocolates, Confectionary & Desserts",The Bakers Dozen Banana Walnut Cake..,,309.0,309.0
naturesbasket.co.in,"Chocolates, Confectionary & Desserts",The Whole Truth No Added Sugar 70% ..,,229.0,229.0
naturesbasket.co.in,"Chocolates, Confectionary & Desserts",Tbh Beetroot & Himlayan Rock Salt 7..,,149.0,149.0
naturesbasket.co.in,"Chocolates, Confectionary & Desserts",London Dairy Ice Cream Premium Vani..,,990.0,990.0
naturesbasket.co.in,"Chocolates, Confectionary & Desserts",The Bakers Dozen Banana Walnut Cake..,,185.0,185.0
naturesbasket.co.in,"Chocolates, Confectionary & Desserts",Kwality Walls Magnum Brownie Ice Cr..,,99.0,99.0
naturesbasket.co.in,"Chocolates, Confectionary & Desserts",Lindt Les Grandes 34% Hazelnut Milk..,,600.0,600.0
naturesbasket.co.in,"Chocolates, Confectionary & Desserts",Haribo Chamallows Pink & White ..,140G,225.0,225.0
naturesbasket.co.in,"Chocolates, Confectionary & Desserts",London Dairy Premium Vanilla,500Ml,550.0,550.0
naturesbasket.co.in,"Chocolates, Confectionary & Desserts",Minus 30 Ice Cream - Coconut Vegan ..,,1000.0,1000.0
naturesbasket.co.in,"Chocolates, Confectionary & Desserts",Haagen Dazs Belgian Chocolate Ice C.. click here or scroll to view more,,250.0,250.0
naturesbasket.co.in,World Foods,Colavita Extra Virgin Olive Oil  ..,1L,2495.0,2495.0
naturesbasket.co.in,World Foods,Borges Olive Oil Glass Bottle L,,1350.0,1170.0
naturesbasket.co.in,World Foods,Barilla Spaghetti Pasta  Box,500G,329.0,329.0
