Online_Grocery_Site,Product_Catagory,Product_Name,Quantity,Original_Price,Discounted_Price
naturesbasket.co.in,Fruits & Vegetables,Avocado Pack  (Approx 550-700G),3Pc,499.0,499.0
naturesbasket.co.in,Fruits & Vegetables,Blueberries Imported Combo Pack (12..,,599.0,599.0
naturesbasket.co.in,Fruits & Vegetables,Blueberries Imported 500 Gm,,1199.0,1199.0
naturesbasket.co.in,Fruits & Vegetables,Apple Royal Gala 500 g 1 kg,,249.5,249.5
naturesbasket.co.in,Fruits & Vegetables,Raspberry Indian 125 Gm Punnet,,449.0,449.0
naturesbasket.co.in,Fruits & Vegetables,Pomegranate Red 500 g 1 kg,,249.5,249.5
naturesbasket.co.in,Fruits & Vegetables,Orange Mandarins Combo (Approx 900 ..,,539.0,539.0
naturesbasket.co.in,Fruits & Vegetables,Pears Beauty Imported 500 g 1 kg,,249.5,249.5
naturesbasket.co.in,Fruits & Vegetables,Broccoli (Approx 250 - ),350G,69.0,59.0
naturesbasket.co.in,Fruits & Vegetables,Imported Avocado,,429.0,429.0
naturesbasket.co.in,Fruits & Vegetables,Elaichi Banana 250 g 500 g 1 kg,,54.75,54.75
naturesbasket.co.in,Fruits & Vegetables,Apple Fuji 500 g 1 kg,,274.5,274.5
naturesbasket.co.in,Fruits & Vegetables,APPLE PINK LADY 4 PC PACK,,279.0,279.0
naturesbasket.co.in,Fruits & Vegetables,Tangerine 500 g 1 kg,,114.5,114.5
naturesbasket.co.in,Fruits & Vegetables,Mushroom Button,200G,55.0,55.0
naturesbasket.co.in,Fruits & Vegetables,Apple Red Delicious Washington 500 g 1 kg,,299.5,299.5
naturesbasket.co.in,Fruits & Vegetables,Imported Blueberry,,349.0,349.0
naturesbasket.co.in,Fruits & Vegetables,Tomato 500 g 1 kg 2 kg,,39.5,39.5
naturesbasket.co.in,Fruits & Vegetables,Kiwi Green  [1 Pack],3Pc,219.0,219.0
naturesbasket.co.in,Fruits & Vegetables,Imported Red Globe Grapes 200 g 500 g 1 kg,,69.8,69.8
naturesbasket.co.in,Fruits & Vegetables,Italian Lemon 150 g 300 g 500 g,,82.35,82.35
naturesbasket.co.in,Fruits & Vegetables,Natures Spinach 200 Gm,,59.0,59.0
naturesbasket.co.in,Fruits & Vegetables,Capsicum Red 1 kg 500 g 250 g,,399.0,399.0
naturesbasket.co.in,Fruits & Vegetables,Apple Pink Lady 1 kg 500 g 250 g,,419.0,419.0
naturesbasket.co.in,Fruits & Vegetables,Apple Pink Lady,,419.0,419.0
naturesbasket.co.in,Fruits & Vegetables,AVOCADO HASS IMPORTED PACK (2PC-450..,,799.0,799.0
naturesbasket.co.in,Fruits & Vegetables,Natures Cherry Tomato Red 200 Gm,,65.0,65.0
naturesbasket.co.in,Fruits & Vegetables,Natures Baby Spinach 200 Gm,,55.0,55.0
naturesbasket.co.in,Fruits & Vegetables,Dragon Fruit Red Flesh  (Approx ..,1Pc,119.0,119.0
naturesbasket.co.in,Fruits & Vegetables,Onion 500 g 1 kg 2 kg click here or scroll to view more,,39.5,39.5
naturesbasket.co.in,"Meats, Seafood & Eggs",Farm Made Free Range Eggs,12Pcs,289.0,289.0
naturesbasket.co.in,"Meats, Seafood & Eggs",Zorabian Chicken Breast Boneless 45..,,275.0,275.0
naturesbasket.co.in,"Meats, Seafood & Eggs",Chicken Breast Bone Less Kg 500 g 1 kg,,295.0,295.0
naturesbasket.co.in,"Meats, Seafood & Eggs",Zorabian Chi Pre Cut Without Skin 9..,,295.0,295.0
naturesbasket.co.in,"Meats, Seafood & Eggs",Zorabian Chicken Leg Boneless,450G,275.0,275.0
naturesbasket.co.in,"Meats, Seafood & Eggs",Mutton Curry Cut Kg 250 g 500 g 1 kg,,257.5,257.5
naturesbasket.co.in,"Meats, Seafood & Eggs",Farm Made Foods Made Free Range Egg..,,149.0,149.0
naturesbasket.co.in,"Meats, Seafood & Eggs",White Prawns Small Kg 250 g 500 g 1 kg,,247.5,137.25
naturesbasket.co.in,"Meats, Seafood & Eggs",Zorabian Chicken Mince,450G,255.0,255.0
naturesbasket.co.in,"Meats, Seafood & Eggs",Zorabian Chi Drumstick Without Skin..,,265.0,265.0
naturesbasket.co.in,"Meats, Seafood & Eggs",Keggs Organic Eggs Pack Of6th,,140.0,140.0
naturesbasket.co.in,"Meats, Seafood & Eggs",Big Sams Salmon Portions,300G,1750.0,1750.0
naturesbasket.co.in,"Meats, Seafood & Eggs",Atlantic Salmon Steaks Kg 250 g 500 g 1 kg,,875.0,875.0
naturesbasket.co.in,"Meats, Seafood & Eggs",Surmai Steaks Kg 250 g 500 g 1 kg,,562.5,562.5
naturesbasket.co.in,"Meats, Seafood & Eggs",Keggs Cage Free Tan Eggs 12 Eggs,,270.0,270.0
naturesbasket.co.in,"Meats, Seafood & Eggs",Chicken Curry Cut Kg 500 g 1 kg,,165.0,165.0
naturesbasket.co.in,"Meats, Seafood & Eggs",Real Good Chicken Chicken Breast B..,,275.0,275.0
naturesbasket.co.in,"Meats, Seafood & Eggs",Gadre Edamame  Pouch,500G,500.0,500.0
naturesbasket.co.in,"Meats, Seafood & Eggs",Real Good Chicken Curry Cut 900 Gm,,295.0,295.0
naturesbasket.co.in,"Meats, Seafood & Eggs",Zorabian Chicken Cubes 500 G,,280.0,280.0
naturesbasket.co.in,"Meats, Seafood & Eggs",Mega Plus Eggs,6Pc,87.0,87.0
naturesbasket.co.in,"Meats, Seafood & Eggs",White Pomfret Medium Kg 1 kg,,1940.0,1940.0
naturesbasket.co.in,"Meats, Seafood & Eggs",Big Sams Salmon Portions,200G,1250.0,1250.0
naturesbasket.co.in,"Meats, Seafood & Eggs",Zorabian Chicken Mixed Boneless 450..,,285.0,285.0
naturesbasket.co.in,"Meats, Seafood & Eggs",Mutton Mince Kg 250 g 500 g 1 kg,,362.5,362.5
naturesbasket.co.in,"Meats, Seafood & Eggs",Prasuma Streaky Bacon  Pouch,150G,395.0,395.0
naturesbasket.co.in,"Meats, Seafood & Eggs",Big Sams Smoked Salmon Slice,100G,950.0,950.0
naturesbasket.co.in,"Meats, Seafood & Eggs",Zorabian Chicken Legs Without Skin ..,,210.0,210.0
naturesbasket.co.in,"Meats, Seafood & Eggs",Keggs Goldens Cage Free Eggs  ..,12Pcs,280.0,280.0
naturesbasket.co.in,"Meats, Seafood & Eggs",Upf Healthy Brown Eggs  Carton click here or scroll to view more,12Pcs,193.0,193.0
naturesbasket.co.in,Bakery & Dairy,Epigamia Natural Yoghurt  Cup,400G,220.0,220.0
naturesbasket.co.in,Bakery & Dairy,Amul Salted Butter  Pkt,100G,58.0,58.0
naturesbasket.co.in,Bakery & Dairy,Amul Salted Butter  Pkt,500G,285.0,285.0
naturesbasket.co.in,Bakery & Dairy,Sprinng Plain Bread Gluten Free 200..,,230.0,230.0
naturesbasket.co.in,Bakery & Dairy,Amul Taaza Toned Uht Milk  Tetra ..,1L,74.0,74.0
naturesbasket.co.in,Bakery & Dairy,Sarda Farm A2 Milk  Tetra Pack,1L,150.0,150.0
naturesbasket.co.in,Bakery & Dairy,Epigamia Natural Yoghurt  Cup,85G,55.0,55.0
naturesbasket.co.in,Bakery & Dairy,Natures Whole Wheat Bread  Pack,400G,85.0,85.0
naturesbasket.co.in,Bakery & Dairy,Raw Pressery Plain Unsweetened Almo..,,325.0,292.5
naturesbasket.co.in,Bakery & Dairy,Raw Pressery Plain Unsweetened Almo..,,325.0,292.5
naturesbasket.co.in,Bakery & Dairy,The Bakers Dozen Sourd Dough Four G..,,235.0,235.0
naturesbasket.co.in,Bakery & Dairy,Natures Multigrain Bread  Pack,400G,95.0,95.0
naturesbasket.co.in,Bakery & Dairy,Epigamia Greek Yogurt Strawberry 90..,,55.0,55.0
naturesbasket.co.in,Bakery & Dairy,Lurpak Salted Butter  Pack,200G,695.0,695.0
naturesbasket.co.in,Bakery & Dairy,Haribol A2 Malai Paneer Made From ..,,160.0,150.0
naturesbasket.co.in,Bakery & Dairy,Epigamia Blueberry Yoghurt  Cup,85G,55.0,55.0
naturesbasket.co.in,Bakery & Dairy,Lurpak Danish Butter Unsalted  ..,200G,695.0,695.0
naturesbasket.co.in,Bakery & Dairy,Natures Guacamole,200G,499.0,499.0
naturesbasket.co.in,Bakery & Dairy,Id Natural Paneer  Pack,200G,130.0,130.0
naturesbasket.co.in,Bakery & Dairy,Id Natural Paneer  Pack,200G,130.0,130.0
naturesbasket.co.in,Bakery & Dairy,Yakult Probiotic Health Drink ..,325Ml,80.0,80.0
naturesbasket.co.in,Bakery & Dairy,Sorrentina Italian Garlic Bread 150..,,129.0,109.0
naturesbasket.co.in,Bakery & Dairy,The Bakers Dozen Country Sourdough ..,,159.0,159.0
naturesbasket.co.in,Bakery & Dairy,Arla Whipping Cream,200Ml,475.0,475.0
naturesbasket.co.in,Bakery & Dairy,Murginns Fresh And Firm Tofu  P..,200G,100.0,100.0
naturesbasket.co.in,Bakery & Dairy,Nutoras Natural Cowmilk Paneer .. 3,200G,110.0,110.0
naturesbasket.co.in,Bakery & Dairy,Sprinng Multiseed Bread  Pouch,200G,240.0,240.0
naturesbasket.co.in,Bakery & Dairy,Epigamia Mango Yoghurt  Cup,85G,55.0,55.0
naturesbasket.co.in,Bakery & Dairy,Arla Whipping Cream,1L,1425.0,1225.0
naturesbasket.co.in,Bakery & Dairy,Amul Lactose Free Drink  Tetra.. click here or scroll to view more,250Ml,25.0,25.0
naturesbasket.co.in,Delicatessen & Cheese,Prasuma Streaky Bacon  Pouch,150G,395.0,395.0
naturesbasket.co.in,Delicatessen & Cheese,Zanetti Gran Spicco Hard Cheese 200..,,995.0,995.0
naturesbasket.co.in,Delicatessen & Cheese,Haribol A2 Malai Paneer Made From ..,,160.0,150.0
naturesbasket.co.in,Delicatessen & Cheese,Rosenborg Danish Brie Cheese  B..,125G,585.0,585.0
naturesbasket.co.in,Delicatessen & Cheese,Dlecta Feta,250G,250.0,229.0
naturesbasket.co.in,Delicatessen & Cheese,Arla Cheese Gouda  Pouch,150G,715.0,715.0
naturesbasket.co.in,Delicatessen & Cheese,Dlecta Cheese Feta  Pack,100G,120.0,111.0
naturesbasket.co.in,Delicatessen & Cheese,Dlecta Parmesan Extra Hard Cheese B..,,300.0,300.0
naturesbasket.co.in,Delicatessen & Cheese,Arla Mozzarella Cheese Block  .. 100 g 200 g 300 g 500 g,2.3Kg,290.0,290.0
naturesbasket.co.in,Delicatessen & Cheese,Id Natural Paneer  Pack,200G,130.0,130.0
naturesbasket.co.in,Delicatessen & Cheese,Id Natural Paneer  Pack,200G,130.0,130.0
naturesbasket.co.in,Delicatessen & Cheese,Amul Cheese Slice  Pkt,200G,145.0,145.0
naturesbasket.co.in,Delicatessen & Cheese,Murginns Fresh And Firm Tofu  P..,200G,100.0,100.0
naturesbasket.co.in,Delicatessen & Cheese,Dlecta Cream Cheese  Tub,150G,200.0,189.0
naturesbasket.co.in,Delicatessen & Cheese,Nutoras Natural Cowmilk Paneer .. 3,200G,110.0,110.0
naturesbasket.co.in,Delicatessen & Cheese,El Pastor Goat Chese Rindles Fresh .. 300 g 200 g 100 g,,1980.0,1980.0
naturesbasket.co.in,Delicatessen & Cheese,Bauwens Tradtional Honey Roasted Ha.. CUTs AVAILABLEThinMediumThickCube 250 g 500 g 1 kg,,1250.0,1250.0
naturesbasket.co.in,Delicatessen & Cheese,Dlecta Cheese Cheddar Slice  Pa..,200G,220.0,199.0
naturesbasket.co.in,Delicatessen & Cheese,Nutoras Cheese Parmesan Block  ..,100G,310.0,310.0
naturesbasket.co.in,Delicatessen & Cheese,Nutoras Cheese Parmesan Block  ..,100G,310.0,310.0
naturesbasket.co.in,Delicatessen & Cheese,Beretta Salami Milano  Pack,100G,725.0,725.0
naturesbasket.co.in,Delicatessen & Cheese,Landana Premium Dutch Gouda  CUTs AVAILABLESlicedCubedGrated 100 g 200 g 300 g 500 g,4.5Kg,278.4,278.4
naturesbasket.co.in,Delicatessen & Cheese,Landana Gouda With Chilli Sambal 4... CUTs AVAILABLESlicedCubedGrated 100 g 200 g 300 g 500 g,,610.0,610.0
naturesbasket.co.in,Delicatessen & Cheese,Wingreens Farms Original Classic Hu..,,200.0,134.0
naturesbasket.co.in,Delicatessen & Cheese,Colliers Cheddar Yellow Cheese Bloc.. CUTs AVAILABLESlicedCubedGrated 100 g 200 g 300 g 500 g,,248.0,248.0
naturesbasket.co.in,Delicatessen & Cheese,Arla Shredded Mozzarella  Pouch,175G,650.0,650.0
naturesbasket.co.in,Delicatessen & Cheese,Prasuma Smoked Bacon Cubes  Pou..,200G,360.0,360.0
naturesbasket.co.in,Delicatessen & Cheese,Wingreens Original Olive Hummus 150..,,200.0,134.0
naturesbasket.co.in,Delicatessen & Cheese,Dlecta Cream Cheese,1Kg,880.0,829.0
naturesbasket.co.in,Delicatessen & Cheese,Dlecta Cheese Cheddar Block  Pa.. click here or scroll to view more,200G,220.0,189.0
naturesbasket.co.in,"Chocolates, Confectionary & Desserts",Ferrero Rocher Gift Pack  (16 P..,200G,549.0,549.0
naturesbasket.co.in,"Chocolates, Confectionary & Desserts",Ferrero Rocher Gift Pack  (16 P..,300G,929.0,929.0
naturesbasket.co.in,"Chocolates, Confectionary & Desserts",Ferrero Rocher 4 Pralines Perfect L..,,159.0,159.0
naturesbasket.co.in,"Chocolates, Confectionary & Desserts",Lindt Napolitains Assorted Chocolat..,,1600.0,1600.0
naturesbasket.co.in,"Chocolates, Confectionary & Desserts",Lindt Lindor Assorted,200G,800.0,800.0
naturesbasket.co.in,"Chocolates, Confectionary & Desserts",Lindt Lindor Balls Milk Chocolate 2..,,800.0,800.0
naturesbasket.co.in,"Chocolates, Confectionary & Desserts",Haagen Dazs Ice Cream Belgian Choco..,,820.0,820.0
naturesbasket.co.in,"Chocolates, Confectionary & Desserts",Lindt Excellence 70% Cocoa Dark 100..,,400.0,400.0
naturesbasket.co.in,"Chocolates, Confectionary & Desserts",Lindt 90% Cocoa Dark Supreme Noir C..,,450.0,450.0
naturesbasket.co.in,"Chocolates, Confectionary & Desserts",Kwality Walls Magnum Almond Ice Cre..,,99.0,99.0
naturesbasket.co.in,"Chocolates, Confectionary & Desserts",The Whole Truth Fruit & Nut Milk Ch..,,99.0,99.0
naturesbasket.co.in,"Chocolates, Confectionary & Desserts",Minus 30 Ice Cream - Espresso Vegan..,,1000.0,1000.0
naturesbasket.co.in,"Chocolates, Confectionary & Desserts",Lindt Excellence Sea Salt Dark Choc..,,400.0,400.0
naturesbasket.co.in,"Chocolates, Confectionary & Desserts",Lindt Lindor Dark Chocolates,200G,1050.0,1050.0
naturesbasket.co.in,"Chocolates, Confectionary & Desserts",Kwality Walls Magnum Truffle Ice Cr..,,99.0,99.0
naturesbasket.co.in,"Chocolates, Confectionary & Desserts",Lindt Excellence Orange Intense Dar..,,400.0,400.0
naturesbasket.co.in,"Chocolates, Confectionary & Desserts",The Whole Truth No Added Sugar 71% ..,,199.0,199.0
naturesbasket.co.in,"Chocolates, Confectionary & Desserts",Minus 30 Ice Cream - Dark Choc Vega..,,1000.0,1000.0
naturesbasket.co.in,"Chocolates, Confectionary & Desserts",The Bakers Dozen Banana Walnut Cake..,,309.0,309.0
naturesbasket.co.in,"Chocolates, Confectionary & Desserts",The Bakers Dozen Banana Walnut Cake..,,309.0,309.0
naturesbasket.co.in,"Chocolates, Confectionary & Desserts",The Whole Truth No Added Sugar 70% ..,,229.0,229.0
naturesbasket.co.in,"Chocolates, Confectionary & Desserts",Tbh Beetroot & Himlayan Rock Salt 7..,,149.0,149.0
naturesbasket.co.in,"Chocolates, Confectionary & Desserts",London Dairy Ice Cream Premium Vani..,,990.0,990.0
naturesbasket.co.in,"Chocolates, Confectionary & Desserts",The Bakers Dozen Banana Walnut Cake..,,185.0,185.0
naturesbasket.co.in,"Chocolates, Confectionary & Desserts",Kwality Walls Magnum Brownie Ice Cr..,,99.0,99.0
naturesbasket.co.in,"Chocolates, Confectionary & Desserts",Lindt Les Grandes 34% Hazelnut Milk..,,600.0,600.0
naturesbasket.co.in,"Chocolates, Confectionary & Desserts",Haribo Chamallows Pink & White ..,140G,225.0,225.0
naturesbasket.co.in,"Chocolates, Confectionary & Desserts",London Dairy Premium Vanilla,500Ml,550.0,550.0
naturesbasket.co.in,"Chocolates, Confectionary & Desserts",Minus 30 Ice Cream - Coconut Vegan ..,,1000.0,1000.0
naturesbasket.co.in,"Chocolates, Confectionary & Desserts",Haagen Dazs Belgian Chocolate Ice C.. click here or scroll to view more,,250.0,250.0
naturesbasket.co.in,World Foods,Colavita Extra Virgin Olive Oil  ..,1L,2495.0,2495.0
naturesbasket.co.in,World Foods,Borges Olive Oil Glass Bottle L,,1350.0,1170.0
naturesbasket.co.in,World Foods,Barilla Spaghetti Pasta  Box,500G,329.0,329.0
naturesbasket.co.in,World Foods,Shitake Mushroom 250 g 1 kg,,824.75,824.75
naturesbasket.co.in,World Foods,Borges Extra Virgin Olive Oil  Pe..,2L,2700.0,2700.0
naturesbasket.co.in,World Foods,Colavita Extra Virg Olive Oil Pet 5..,,1495.0,1495.0
naturesbasket.co.in,World Foods,Salsalito Original Tortilla Wrap 34..,,190.0,190.0
naturesbasket.co.in,World Foods,Borges Extra Virgin Olive Oil Pet 5..,,1050.0,1050.0
naturesbasket.co.in,World Foods,Borges Extra Virgin Olive Oil Jar 2..,,400.0,364.0
naturesbasket.co.in,World Foods,Wingreens Farms Original Classic Hu..,,200.0,134.0
naturesbasket.co.in,World Foods,Brown Shimeji Mushroom 150 g 300 g,,494.85,494.85
naturesbasket.co.in,World Foods,Wingreens Original Olive Hummus 150..,,200.0,134.0
naturesbasket.co.in,World Foods,Barilla Basilico Pasta Sauce,400G,499.0,499.0
naturesbasket.co.in,World Foods,Mushroom Shi-Meji White Kg  125 g 1 kg,125G,412.38,412.38
naturesbasket.co.in,World Foods,Enoki Mushroom 1 kg,,3399.0,3399.0
naturesbasket.co.in,World Foods,Black And Green Avocado Oil  B..,500Ml,1599.0,1599.0
naturesbasket.co.in,World Foods,Wingreens Farms Basil Pesto,150G,250.0,250.0
naturesbasket.co.in,World Foods,Barilla Arrabiata Pasta Sauce,400G,499.0,499.0
naturesbasket.co.in,World Foods,Bertolli Extra Light Olive Oil Jar ..,,4299.0,4299.0
naturesbasket.co.in,World Foods,Barilla Penne Rigate Pasta  Box,500G,329.0,329.0
naturesbasket.co.in,World Foods,Carbamide Forte Coconut Oil  J..,500Ml,679.0,679.0
naturesbasket.co.in,World Foods,Dabur Hommade Coconut Milk  Po..,200Ml,75.0,75.0
naturesbasket.co.in,World Foods,Sorrentina Basil Seed Pesto  Ja..,200G,375.0,349.0
naturesbasket.co.in,World Foods,Rafael Salgado Extra Light Olive Oi..,,3339.0,2470.86
naturesbasket.co.in,World Foods,Borges Pure Olive Oil  Bottle,1L,1350.0,1170.0
naturesbasket.co.in,World Foods,Sorrentina Italian Garlic Hummus 20..,,299.0,259.0
naturesbasket.co.in,World Foods,Wingreens Farms Dill Tzatziki,150G,200.0,200.0
naturesbasket.co.in,World Foods,Wingreens Farms Garlic Dip,150G,200.0,134.0
naturesbasket.co.in,World Foods,Bombucha Sauerkraut Kimchi,450G,450.0,430.0
naturesbasket.co.in,World Foods,Nongshim Shn Rmyn Noodle Soup 5In1 .. click here or scroll to view more,,599.0,599.0
naturesbasket.co.in,"Breakfast, Jams, Honey, Spreads",Conscious Food Wild Forest Honey 20..,,240.0,228.0
naturesbasket.co.in,"Breakfast, Jams, Honey, Spreads",Nutella Hazelnut Spread  Jar,180G,239.0,239.0
naturesbasket.co.in,"Breakfast, Jams, Honey, Spreads",Conscious Food Wild Forest Honey 50..,,480.0,456.0
naturesbasket.co.in,"Breakfast, Jams, Honey, Spreads",Id 100% Authentic Fresh Batter Idly..,,90.0,90.0
naturesbasket.co.in,"Breakfast, Jams, Honey, Spreads",Wingreens Farms Original Classic Hu..,,200.0,134.0
naturesbasket.co.in,"Breakfast, Jams, Honey, Spreads",Wingreens Original Olive Hummus 150..,,200.0,134.0
naturesbasket.co.in,"Breakfast, Jams, Honey, Spreads",Bobs Red Mill Gluten Free Roled Oat..,,1330.0,1330.0
naturesbasket.co.in,"Breakfast, Jams, Honey, Spreads",Nutella Hazelnut Spread  Jar,350G,399.0,399.0
naturesbasket.co.in,"Breakfast, Jams, Honey, Spreads",Wingreens Farms Basil Pesto,150G,250.0,250.0
naturesbasket.co.in,"Breakfast, Jams, Honey, Spreads",The Whole Truth Double Cocoa Protei..,,100.0,100.0
naturesbasket.co.in,"Breakfast, Jams, Honey, Spreads",The Whole Truth Nuts Fruits & Seeds..,,325.0,325.0
naturesbasket.co.in,"Breakfast, Jams, Honey, Spreads",The Whole Truth Choco Variety Prote..,,600.0,600.0
naturesbasket.co.in,"Breakfast, Jams, Honey, Spreads",Conscious Food Himalayan Multi Flor..,,680.0,612.0
naturesbasket.co.in,"Breakfast, Jams, Honey, Spreads",Sorrentina Basil Seed Pesto  Ja..,200G,375.0,349.0
naturesbasket.co.in,"Breakfast, Jams, Honey, Spreads",Healthy Alternatives Rolled Oats500..,,215.0,215.0
naturesbasket.co.in,"Breakfast, Jams, Honey, Spreads",Sorrentina Italian Garlic Hummus 20..,,299.0,259.0
naturesbasket.co.in,"Breakfast, Jams, Honey, Spreads",Wingreens Farms Dill Tzatziki,150G,200.0,200.0
naturesbasket.co.in,"Breakfast, Jams, Honey, Spreads",Wingreens Farms Garlic Dip,150G,200.0,134.0
naturesbasket.co.in,"Breakfast, Jams, Honey, Spreads",The Whole Truth Cranberry Protein B..,,100.0,100.0
naturesbasket.co.in,"Breakfast, Jams, Honey, Spreads",The Whole Truth Choco Fruit Cruch ..,,325.0,325.0
naturesbasket.co.in,"Breakfast, Jams, Honey, Spreads",Ferrero Nutella,750G,769.0,769.0
naturesbasket.co.in,"Breakfast, Jams, Honey, Spreads",Wingreens Farms Cheesy Jalapeno Sau..,,250.0,250.0
naturesbasket.co.in,"Breakfast, Jams, Honey, Spreads",Wingreens Farms Chipotle Dip Spread..,,200.0,134.0
naturesbasket.co.in,"Breakfast, Jams, Honey, Spreads",Saucery Aglio Olio Sauce,200G,290.0,290.0
naturesbasket.co.in,"Breakfast, Jams, Honey, Spreads",Heinz Organic Tomato Ketchup Top Do..,,1195.0,1195.0
naturesbasket.co.in,"Breakfast, Jams, Honey, Spreads",Wingreens Farms Peri Peri Hummus Di..,,200.0,200.0
naturesbasket.co.in,"Breakfast, Jams, Honey, Spreads",Ritebite Max Prot Ult Choberry,100G,175.0,175.0
naturesbasket.co.in,"Breakfast, Jams, Honey, Spreads",The Whole Truth Peanut Cocao Protei..,,100.0,100.0
naturesbasket.co.in,"Breakfast, Jams, Honey, Spreads",Bobs Red Mill Extra Thick Rolled Oa..,,830.0,830.0
naturesbasket.co.in,"Breakfast, Jams, Honey, Spreads",Ritebite Max Protein Daily (10G Pro.. click here or scroll to view more,,175.0,175.0
naturesbasket.co.in,Grocery,Parsi Dairy Cows Ghee L,,1245.0,1245.0
naturesbasket.co.in,Grocery,Parsi Dairy Cows Ghee L,,1245.0,1245.0
naturesbasket.co.in,Grocery,Natures American Almonds,1Kg,1299.0,1299.0
naturesbasket.co.in,Grocery,Conscious Food Gir Cow Ghee  J..,500Ml,2250.0,2137.5
naturesbasket.co.in,Grocery,Parsi Dairy Cows Ghee 500 Ml,,650.0,650.0
naturesbasket.co.in,Grocery,Conscious Food Desi A2 Cowghee  B..,1L,2190.0,2080.5
naturesbasket.co.in,Grocery,Healthy Alternatives Organic Walnut..,,1399.0,1399.0
naturesbasket.co.in,Grocery,Dry Fruits Gift  Box,400G,375.0,375.0
naturesbasket.co.in,Grocery,Ha Bn Chilean Walnuts 250 g 500 g 1 kg,,625.0,625.0
naturesbasket.co.in,Grocery,Colavita Extra Virgin Olive Oil  ..,1L,2495.0,2495.0
naturesbasket.co.in,Grocery,Ha Bn Mamra Almonds 250 g 500 g 1 kg,,1200.0,1200.0
naturesbasket.co.in,Grocery,Conscious Food Wild Forest Honey 50..,,480.0,456.0
naturesbasket.co.in,Grocery,Medjoul Super Jumbo Dates 1 kg 250 g 500 g,,3440.0,3440.0
naturesbasket.co.in,Grocery,Borges Olive Oil Glass Bottle L,,1350.0,1170.0
naturesbasket.co.in,Grocery,Healthy Alternatives Walnut Kernel ..,,768.0,768.0
naturesbasket.co.in,Grocery,Natures Figs  Pouch,250G,1119.0,1119.0
naturesbasket.co.in,Grocery,Borges Extra Virgin Olive Oil  Pe..,2L,2700.0,2700.0
naturesbasket.co.in,Grocery,Concious Food Desi Cow Ghee  J..,500Ml,1090.0,1090.0
naturesbasket.co.in,Grocery,Colavita Extra Virg Olive Oil Pet 5..,,1495.0,1495.0
naturesbasket.co.in,Grocery,Ha Bn Anjeer Aaa 250 g 500 g 1 kg,,900.0,900.0
naturesbasket.co.in,Grocery,Helthy Alternative Dates Medjoul 30..,,649.0,649.0
naturesbasket.co.in,Grocery,Borges Extra Virgin Olive Oil Pet 5..,,1050.0,1050.0
naturesbasket.co.in,Grocery,Borges Extra Virgin Olive Oil Jar 2..,,400.0,364.0
naturesbasket.co.in,Grocery,Healthy Alternatives Saudi Dates 50..,,699.0,699.0
naturesbasket.co.in,Grocery,Natures Cashew Whole 240,500G,999.0,999.0
naturesbasket.co.in,Grocery,Ha Bn Khajoor Medjul 250 g 500 g 1 kg,,624.75,624.75
naturesbasket.co.in,Grocery,Black And Green Avocado Oil  B..,500Ml,1599.0,1599.0
naturesbasket.co.in,Grocery,Healthy Alternatives Almond Flour ..,,1420.0,1420.0
naturesbasket.co.in,Grocery,Ajwa Dates 1 kg 250 g 500 g,,2560.0,2560.0
naturesbasket.co.in,Grocery,Sanjeevani Traditional Ghee  .. click here or scroll to view more,600Ml,1035.0,1035.0
naturesbasket.co.in,Gourmet Platters,Nb Classy Cheese Platter,,1500.0,1500.0
naturesbasket.co.in,Gourmet Platters,Cheese And Me,,399.0,399.0
naturesbasket.co.in,Gourmet Platters,Nb Premium Cheese Platter,,4000.0,4000.0
naturesbasket.co.in,Gourmet Platters,Meat Platter Turkey - 699,,699.0,699.0
naturesbasket.co.in,Gourmet Platters,Meat Platter Chicken & Turkey - 999,,999.0,999.0
naturesbasket.co.in,Gourmet Platters,Meat Platter Chicken Turkey Pork - ..,,899.0,899.0
naturesbasket.co.in,Gourmet Platters,Get Fetagoudapepper Jackbrie In One..,,799.0,799.0
naturesbasket.co.in,Gourmet Platters,Meat Platter Chicken & Pork - 799,,799.0,799.0
naturesbasket.co.in,Gourmet Platters,Meat Platter Chicken - 399,,399.0,399.0
naturesbasket.co.in,Gourmet Platters,Mini Party Platter,,699.0,699.0
naturesbasket.co.in,Gourmet Platters,Meat Platter Pork - 699,,699.0,699.0
naturesbasket.co.in,Gourmet Platters,Meat Platter Chicken & Turkey Pork ..,,1199.0,1199.0
naturesbasket.co.in,Beverages,Perrier Carbonated Water  Bott..,330Ml,165.0,165.0
naturesbasket.co.in,Beverages,Raw Pressery Orange Juice1l Tetra P..,,350.0,350.0
naturesbasket.co.in,Beverages,Davidoff Rich Aroma Instant Coffee ..,,650.0,650.0
naturesbasket.co.in,Beverages,Himalaya Natural Mineral Water  B..,1L,70.0,70.0
naturesbasket.co.in,Beverages,Davidoff Espresso 57 Intense Instan..,,650.0,650.0
naturesbasket.co.in,Beverages,Raw Pressery Orange Juice  Bot..,250Ml,120.0,120.0
naturesbasket.co.in,Beverages,PRIME TROPICALPUNCH HYDRATION DRINK..,,1050.0,1050.0
naturesbasket.co.in,Beverages,Tea Culture Skin Glow 1 kg 100 g 250 g 500 g,,19900.0,19900.0
naturesbasket.co.in,Beverages,Perrier Carbonated Water  Bott..,750Ml,275.0,275.0
naturesbasket.co.in,Beverages,PRIME BLUE RASPBERRY HYDRATION DRIN..,,1050.0,1050.0
naturesbasket.co.in,Beverages,Tea Culture Throat Rescue Loose Tea 1 kg 100 g 250 g 500 g,,15900.0,15900.0
naturesbasket.co.in,Beverages,PRIME ICE POP SUCETTE GLACEE HYDRAT..,,1050.0,1050.0
naturesbasket.co.in,Beverages,Davidoff Fine Aroma Instant Coffee ..,,650.0,650.0
naturesbasket.co.in,Beverages,Raw Pressery Coconut Water 200 Ml,,60.0,60.0
naturesbasket.co.in,Beverages,Evian Natural Mineral Water,500Ml,150.0,150.0
naturesbasket.co.in,Beverages,Evian Natural Mineral Water,500Ml,150.0,150.0
naturesbasket.co.in,Beverages,Raw Pressery Pomegranate Juice1l Te..,,450.0,450.0
naturesbasket.co.in,Beverages,Only Earth Oats Milk Unsweetened ..,1L,295.0,295.0
naturesbasket.co.in,Beverages,Tea Culture Masala Chai Ctc Loose T.. 1 kg 100 g 250 g 500 g,,3500.0,3500.0
naturesbasket.co.in,Beverages,PRIME LEMON LIME HYDRATION DRINK 50,,1050.0,1050.0
naturesbasket.co.in,Beverages,Raw Pressery Mango Juice  Bottle,1L,250.0,250.0
naturesbasket.co.in,Beverages,Tea Culture Masala Chai Loose Tea 1 kg 100 g 250 g 500 g,,13900.0,13900.0
naturesbasket.co.in,Beverages,Raw Pressery Coconut Water  Bo..,200Ml,360.0,360.0
naturesbasket.co.in,Beverages,Raw Pressery Cold Extracted Great F..,,500.0,500.0
naturesbasket.co.in,Beverages,Tea Culture Detox Loose Tea 1 kg 100 g 250 g 500 g,,15100.0,15100.0
naturesbasket.co.in,Beverages,Tea Culture Jasmine Pearls Loose Te.. 1 kg 100 g 250 g 500 g,,29300.0,29300.0
naturesbasket.co.in,Beverages,Cohoma Original Roasted Coffee ..,250G,685.0,685.0
naturesbasket.co.in,Beverages,Tea Culture Weight Loss 1 kg 100 g 250 g 500 g,,29500.0,29500.0
naturesbasket.co.in,Beverages,Raw Pressery Sugarcane Juice  Tet..,1L,250.0,250.0
naturesbasket.co.in,Beverages,Tea Culture Stressbuster Loose Tea 1 kg 100 g 250 g 500 g click here or scroll to view more,,17000.0,17000.0
naturesbasket.co.in,Snacking,Gadre Edamame  Pouch,500G,500.0,500.0
naturesbasket.co.in,Snacking,Cheetos Flamingo Hot Chips  Pou..,227G,750.0,750.0
naturesbasket.co.in,Snacking,Sapphire Creamy Crackers,350G,200.0,200.0
naturesbasket.co.in,Snacking,Tong Garden Party Snacks,180G,150.0,150.0
naturesbasket.co.in,Snacking,Cheetos Corn Puffs Crunchy Chips 22..,,825.0,825.0
